File Name,Content,Subjectivity/Objectivity
@MS4wLjABAAAAtUWuRxxxwoaCb2659sECxjGF0mt6Vga6jMxmhcrSV4SKy7zYBA57_38ipyc7jTUm_video_7209772492544625966.txt," Hello, I'm a microbiologist and I'm searching your video in hopes of sharing some really valuable food safety information that I sincerely hope you will share with your children as you're teaching in these really important life skills of cooking and food preparation. Chicken meat, like all meat and animal tissue, is porous. It holds onto bacteria so when you run water over it, we are removing a small amount, but most of the bacteria is still there and the best way to make it safe to eat is cooking it to an internal temperature of 165 degrees Fahrenheit. What does happen when we run water over meat is that we aerosolize that bacteria. We spread it all over ourselves. It splashes onto our counters, onto sponges that might be near our sink. In fact, bacteria that has been aerosolized by water can spread up to three feet away from your sink. I don't know what your kitchen looks like in the context of my home. Anything from my sponge to soap bottles, my microwave, the watering can handle, or even my paper towels are potentially left contaminated by salamanella or other bacteria in the meat. Career did make a second video, somewhat responding to some of the comments she was getting, being like, I'm confused, I wash my sink out, which is a good thing. We should be cleaning the areas of our kitchen that we use for food prep, including our sinks, however. Cleaning out your sink or bleaching your sink does nothing for the bacteria that you spread onto yourself, onto services three feet away from your sink, or into the air. The USDA actually performed an observational study regarding washing meat in the home, and they found that of people who washed poultry 60% had bacteria in their sink after washing, and 14% still had bacteria in their sink even after sanitizing and cleaning their sinks. So if the bacteria is still in the sink after you clean it, there's probably a lot of bacteria on surfaces that haven't been cleaned that are within that three feet radius. I understand that a lot of the people who wash their poultry are simply trying to remove the slime, or that pro-tenacious layer that's produced by the muscle. If this bothers you, the best way to deal with it is simply patting it dry with a paper towel. Food safety is also better to assess the safety of the meat, as meat that has spoiled or has bacterial overgrowth, the point where it's no longer safe, won't come dry from the paper towel, and what does come off will be like a yellow green color. I promise you, salmonella is not something you want to experience. Even once, and with an infectious dose that can be as low as 10 individual organisms, it's just not worth the risk. Food safety is really important knowledge for everyone to have, as we will all inevitably have to eat food, prepare food, weather for ourselves, or for other people, and best practices for food safety are one of the primary ways to avoid foodborne illness. Thanks for watching, and I hope you learned something new.",subjective
@publicsafetyunleashed_video_7203203203419131178.txt," I am so sorry to bother you here. You're parked in the handicap spots 250 all are fine and you guys Did you get out of citizens for doing that all over in Walmart right? Yeah, I actually started coming around the corner So I was just parking to stop T. You are yeah, no, I don't think so that's not where you were Yeah, we're kind of do for you today. That's it. You're parked in the handicap spot right there What I'm talking to you right now. You're still can't park in the handicap spot. Yeah, you're parked in the handicap spot Well, you know, it's gonna be that here. Where does it say that? This is this right here is a whole walking thing right up here Fire department over there. Get your stories straight. Cover homes What can I do for you today? You need to move your car out of the handicap spot I am absolutely well. Do you need anything? This is not the first time that I've seen people parking here and why would you park here back in? Catch my question first and I'll do that. Why would you back in exposing yourself to me? I saw you yeah, but you're gonna back in here like this back in and turning your back to me and because someone Move your car",subjective
@desireerenee.12_video_7297075624433192223.txt, Oh I Oh Oh Oh Oh Oh,subjective
@ivangtv_video_7321970590124887338.txt, Historic weather across all of America has cost thousands of schools to be closed tomorrow on Tuesday So as you guys can see from this map right here It seems like every part of America at least has some sort of weather going on and schools are being closed because of it We have the historic snowfall falling in the Midwest right now with predicted of five to eight inches of snow and Nebraska has already started closing schools. We have all the tornado watches and Super severe storms with the rain and wind in the southeast basically covering from Texas to North Carolina Illinois Chicago Indiana and as far south as the Oklahoma Panhandle are now closing schools and asking people to stay home because of the weather tomorrow This really does feel like we've never seen this before where almost every place in America has something going on with the weather New York in the northeast was just slammed a few days ago and now schools all across the country are going to be closed So let me know in the comments has your school already closed or do you think that they're going to be closing tomorrow?,subjective
@animal.track2_video_7358519029696351531.txt," Why is it risky to lay steel coils flat when hauling them? It's actually safer to keep them upright. Handling steel coils requires utmost caution. Because if you have to break suddenly, the consequences could be disastrous. One reason why laying steel coils flat is a no-go is their sheer weight. A single coil can weigh up to a dozen tons. If you lay them flat on the truck bed, all that weight would bear down on the bottom, putting strain on the structure and supports, potentially distorting the coils themselves. Another reason is the complexity of handling them. You need specialized equipment like cranes to precisely locate and secure the coil's core for lifting these heavy loads. If they were laid flat, the equipment wouldn't find suitable positions, making handling even more challenging. So, clearly, standing them upright is the way to go. And it optimizes truck space usage too. But securing them properly is also a skill. Some drivers opt for quick fixes. Only to find coils loosening or breaking on the road with dire consequences. Do you have any good tips for safely and effectively transporting steel coils?",subjective
@voidparticipant_video_7135989060711107882.txt, Here's how you can use your disposable income to support unhoused people in your own community. You now have a bag full of bunch of stuff that will help them and it's a random act of kindness that goes a long way.,subjective
@blind.to.billionaire_video_7342788021391019307.txt," Automatic $1,400, 4th stimulus check in 2024 as the economy is crumbling. I have all the details and exactly what you need to know, right here in the video. Let's get right into it. I know in this video I do want to focus on a $1,400, 4th stimulus check right here right now in 2024 and I do want to share with you the details of what I just got done reading in regards to what they're suggesting is likely going to happen over the coming months. As we all recognize right now is a very busy time and it's also a very important time because we all know what's happening in November. Do you think they're going to allow the economy to go down in a ball of flames just months before November and what's happening then? Well again, I want to share with you the details of what they're suggesting and why this is so incredibly important because if you've been in the camp of somebody that wants a 4th stimulus check right now for 2024 and over the last couple years to be real, well then this is good news and something you certainly want to hear about. Let's get into it and I'll explain all the details, what I just got to done reading and what all this means for this year right now 2024. Really fast before we do. Thanks for joining me. If you have not done so yet, make sure to do yourself a huge, huge favor. Hit that subscribe button right down below the video. It is totally free to do so and I'm here for you right by your side of a single day. Watch in the headlines and all the new information coming out, including but not limited to bills, packages, proposals, announcements, anything popping up you can possibly grab or take advantage of. Like money, benefits, raises to benefits, checks, programs, stimulus, stimulus checks, monthly checks and the list goes on and on. A lot of things are happening right now and the last couple years have been very busy and right now this is also a very, very important and busy year. Either way, I'm here for you in any way that are possibly can be. Again, make sure to do yourself that huge favor, subscribe down below if you haven't done so. And also feel free to share the video with your friends, family, social media. There's a share button right down below the video as well. Again, we've got to stick together right now and the more people we have here in this community, the bigger the influence and impact we have. Anytime we reach out to lawmakers asking them for very important things because the low income and fixed income and virtually all Americans here have been really, really struggling financially the last couple of years. You've seen all the reports and studies I've shared with you over the last couple of years here. Yeah, not a good situation, which by the way, we have well over $1 trillion just in credit card debt in this country. That's massive. Every single time we get the new report to come out, it's a new record of credit card debt. That is not a statistic that we want to have. Okay, again, why do we think this is happening? Because nobody has any money. Their floating balance is on credit card. So again, that's a one other topic. We're not going to discuss that here in this video. But again, you've heard me talk about this stuff before. It's a bad situation out there. Anyway, let's talk about what's going on here. And again, why I say automatic stimulus checks. Now, here's the thing. Let me point out the details of some information that I was just reading. And again, why I want to bring this here attention. Now, stick with me for a minute here. You're going to think at, you know, first glance here. Wait, what does this have to do with anything to do with stimulus checks? It has 100% to do with it. Okay, let me explain the details about this. Now, remember, it's all about the economy. Okay, that is literally what it comes down to every single time. You've heard me say that before. If you've been watching the video, you're on the channel. You know what I'm talking about. I say this all the time, which is it's all about the economy. But most importantly, it's about jobs. Okay, this is really what it comes down to. The job market and unemployment numbers are really basically like the dog or the, yeah, basically I look at the dog that wakes it up. Okay, so it's very, very important. So either way, let me share with you what I just got done reading. They're anticipating within the next few months here, basically sometime between right around mid-summer or so. Again, it could be give or take a little bit here, but they're anticipating by mid-summer, we're likely going to be in a major, major economic recession, economic contraction. And they likely see unemployment going up to about 5.5%. Now again, you might be thinking, okay, we don't care. But what does this have to do anything with the distribution of another stimulus check? It is 100% predicated on this. Now, this is very, very important because the higher that we see the unemployment rate go, it simply means more people are out of work. It simply means that more businesses, big, medium, and small are cutting back on hiring. Maybe they're going bankrupt, maybe they're closing. There's a whole variety of factors. So when we start to see the unemployment rate ticking up, that's not a good sign, right? It simply means that the economy is contracting in a pretty big way. And remember, as of a few months ago, there's about 186 million people in the workforce in the United States, okay? Even an uptick of unemployment by say 1.5% or 2% is a lot of people. That's millions upon millions of people, right? When there's 186 million people in the workforce, and we're talking to say a 2% increase in the unemployment rate over several months here, that's big. That's very, very big, okay? That's very important to understand because we're talking some serious people here. We're talking millions upon millions of people that are losing their jobs. That's not a good situation. Again, is that a sign of a healthy economy when people are losing their jobs? No, okay? You don't need to be an economist. You don't need to be a statistician, anything like that to understand. Jobs being lost means the economy is not doing great, right? It simply means we're not an expansionary period of time, right? Now, something else I want to point out as well. We've been seeing for a while now. Remember, the last year and a half, actually, it's been longer than that to be fair. It's been a long time now. Well over a year and a half, the Federal Reserve was aggressively raising interest rates, right? In fact, over about a little more than a year's time, they raised interest rates 525 basis points or 5.25%. That's a lot. That is like historic, okay? They've never done that, okay? That's very, very important. Now, do you think this is going to contract on the economy? Yep, sure is, okay? Now, here's what else they're suggesting and what I discussed in reading as well. In these reports, now they've said that generally aggressive interest rate hikes like this out of the Federal Reserve generally take about 18 months to actually see the effects on the economy. Well, guess what? That's about right here right now. And that's about mid-summer is when they're anticipating this to all happen, okay? So they're anticipating these massive unemployment spikes up to about 5.5% give or take a little bit. And we're likely going to see all the effects of this 525 basis point rate hike from the Federal Reserve likely hitting the economy sometime around mid-summer. Give or take a little bit.",subjective
@mariedoesstuff_video_7328186584212327722.txt," If you ever eat reheated rice, you're putting yourself at risk of being really, really sick and maybe dying. And it's called reheated rice syndrome. So that's something that comes across my FYP every so often. And then you'll go to the comments and people will be like, I eat reheated rice all the time. I've never been sick. And also, fried rice is a thing that you do commonly, and a lot of cultures all over the world, with your leftover rice. So what's the problem? So let me give you the microbiology background. So let's think of this from a controlling microbial growth perspective. Most things that are going to cause human disease have an optimal growing temperature between about 20 degrees Celsius and 30 degrees Celsius. Most things, not all things. So that's room temperature to just under human body temperature. So that means don't ever let your food that needs to be cooked sit out at room temperature. You don't want it to be at that level of temperature for any length of time. It's either cooked and you are eating it hot or it's been refrigerated and it has stayed cold. You're not leaving it here for hours and hours, that idea. So with rice, what can cause the reheated rice syndrome is one organism specifically called bacillus serious. It's on the same branch of the microbial family tree as things like anthrax and botulism, antetnus, and cdiff. And what all of those have in common is that they can create something called an endospor, which is when the bacterial cell decides to hold up because there's not enough water or the temperature isn't right or there's not enough nutrients around. So it just kind of dries itself out into this almost like little seed and it's just going to wait until things are good. So if those spores are around in your rice, they can resist the cooking temperature at your rice. But then when your rice hits that 20 to 30 degrees Celsius, they're going to say, oh look, there's plenty of water. The temperature is just right and look at all this food and they're going to go crazy. And when they start growing, they are going to make this toxin that will make you very ill and want to throw up. Well, you throw up, not just want to throw up. You have to throw up. It's a medic. So why is this particularly bad with reheating your rice? Well, if you have cooked your rice and then let it sit at room temperature for very long and then put it in the fridge and then go to recook it and you think you're fine because you've cooked it again. No, because you still have spores around that perhaps you didn't germinate the spores the first time around, but now you did. And the second time around or the first time around you did germinate spores, you gave them enough time to grow and create a lot of toxin and then you reheated. Reheating does nothing to the toxin. The toxin is still around will still make you ill. So the biggest lesson that you should take away from this is wash your rice because not only does it have heavy metals and other dirt and stuff, it has these spores on it. So wash your rice. You won't get rid of all of the spores, but you'll reduce your chance of this happening. And second thing is this goes for any food. Don't let it sit out at human body temperature. And if you ever have heard the myth that you can't put hot food in the fridge, it's a myth. Go ahead and put warm food in the fridge. The only exception to that might be that don't put enormous amounts of very hot food in the fridge because it's just not going to cool efficiently. Right? The whole point of this is that you're trying to avoid that middle ground. You either want your food hot or you want your food cold. Don't leave it right here. That's where things grow. There you go.",subjective
@pascal.crisis.ser_video_7325498084933291307.txt," I work in behavioral health. Of course I know how to multitask. I work in behavioral health because I'm not a knock-in. I work in behavioral health. Of course I know how to multitask. I work in behavioral health. Of course I'm here when you need to talk. Hello. Yes, honey. Yes, I'll be home soon. I work in behavioral health. Of course I'm never off.",subjective
@jessicaleighphd_video_6936254654741302534.txt," Mixed anxiety depressive disorder is mental health disorder characterized by the symptoms of depression and anxiety. However, the symptoms alone do not meet criteria for specific depressive disorder or anxiety disorder. So this was a diagnosis in the DSM4 and is not a diagnosis in the DSM5. However, the DSM5 does have adjustment disorder with mixed anxiety and depressed mood. However, the World Health Organization's ICD-10 does recognize mixed anxiety and depressive disorder. So to get a diagnosis of this, you have to have both depressive and anxiety symptoms that neither meet criteria for an individual depressive or anxiety disorder. However, they are severe enough to impair your functioning. If however, your symptoms of depression and or anxiety do meet criteria for a depressive or anxiety disorder, you would be diagnosed with that specific disorder.",subjective
@davebondy_video_7317316200348896555.txt," Okay, government waste. This just coming in. Take a look at this right here. This is happening in Michigan. I'm sure it's happening in other states as well. In audit of the Michigan unemployment insurance agency found inappropriate payments to incarcerated people. So people who are in prison got $35 million in unemployment. 3,000 people who are dead got 19 million. Well, they didn't get it. Almost 6,000 people under the age of 15 got 90 million and 1200 almost 1300 people over the age of 85 got 18 million. So where is this money going? Most likely to scammers, but the state of Michigan paid it out anyway. Payed out all this money to people who should not have been getting it. Well, people who need it aren't able to and they're suffering. So what do you think about this? This is your government everybody. Let me know what you think in the comments below and make sure you are following me. Hit the plus number right over there. I left my job in the mainstream media. I'm keeping it real. Go to my bio here on TikTok to learn how you can support my mission.",subjective
@theconcepttrading_video_7328310041201708290.txt," What's up traders, Julian from Concept Trading. Wanna chat to you guys about economic trends in February? That can help us get a better read on the market. The way I see it, there are a lot of thematics going on, but the major ones seem quite persistent. So we've got disinflation. Looking for a rate cut in the second half of this calendar year, which would be great for all those homeowners. We've got the China Gross Story, Kebion Iron China obviously, they're one of the big growth engines that drive everything, we've just got a print from them. It was below a little below expectation, by 0.1% but above 5%, which is a good thing. We've got geo-political tensions, which I see as moderating, could flare up at any time, that will in itself provide an opportunity, but we're seeing it base in the world prices as a bit of a proxy for what's going on over there. So what this means is the market will be in a bit of a range. Outside of any major news, we'll start to sort of become to the current scenario we're in. Great for range traders. So a good range, I see at the moment, is in equity markets, the Aussie 200 is a good example. In the top of the range, this is mid-January. We want to look for opportunities where that starts to short and then we find a good direction and that hopefully will stay for a while because these branches are quite big. Data will dramatically change this, especially if it's outside of what animals are thinking. So February's quite busy. We've got three interest rate decisions in the first part of the month that is from the US Bank of England and the RBA. And they've got a raft of data starting pretty much straight away with the farm payrolls and then we go into Porta Reed's GDP, CPI, retail sales, those sorts of things that will really give some picture. Outback with looking units, it's a bit of a slow period, November to December January and so you want to keep that all in mind. Gotta be mentally prepared for the month ahead. Hopefully this has helped you out and you're ready to tackle all those situations. Gotta get them.",subjective
@vicky_zzzzzzz_video_7140748214847737094.txt," Welcome to my day two orientation as a master's student for public policy. So MPP is a two year master's program at the University of Toronto. Along with a co-op opportunity, the program teaches you how to examine the challenging issues confronted by governments at all levels and on a global scale. So you will be engaged in policy making, policy analysis, and implementations. I think you'd be a person who's passionate about changing inequality, poverty, discrimination, climate change, healthcare, or indigenous issues, or social justice, this program is definitely for you. A lot of graduates end up working for the provincial or federal governments, sound working, consulting, analysis, or the legal industry. That's the end of my orientation. It asks me anything I'd love to help.",subjective
@_redrosemedia_video_7203585291007823146.txt, I'm gonna show y'all a disaster relief kit I got today Poor windows actually put it together there in Houston. It was completely free They believe strongly in language justice so they gave this document that was translated until you all you need to know about the kit They gave this emergency shelter super useful Emergency drinking water about seven of these Emergency food rations enough for two people They gave water purification tablets They gave these gloves heavy duty a light just crack it They also gave this paracord This super useful kit with a bunch of nice tools those a pin a flashlight and Some other nice things they also gave a mask a first aid travel kit Some hygiene products emergency survival blanket and goggles and emergency poncho a warmer and A portable radio with a light actually and that's all,subjective
@fiventwo_video_7071717776515157294.txt, The only foods people think we give out at the food bank. Add a little bit of spice. But we have so many options like bakery and fresh produce.,subjective
@shaochiehlo_video_7269199026598186283.txt," What is the digital divide? The digital divide refers to the disparity between individual communities and country regarding access to information and communication technologies, particularly the Internet and Computers. It's not just about physical access, it can pass disparity in scale usage and a benefit to rise from these technologies. This divide can be driven by factors like socioeconomic status, education, geography, and age. Urban areas, for instance, often have better connectivity than rural ones. But digital divide perpetuates inequality, as low as without access are left behind in a rapidly digital-living world. Dredging the gap is crucial for ensuring equitable access to information, opportunities, and participation in global digital economy. But addressing the digital divide is imperative for fostering social and economic development, reducing inequality and promoting inclusive growth.",subjective
