File Name,Content,Subjectivity/Objectivity
@foodbankofsocal_video_7235067339002187050.txt," The food bank of Southern California had its monthly mobile food pantry in partnership with adventures to drink. Our volunteers were staff members of United Health Care. Every third Friday of the month, the food bank and adventures to dreams feed many people in the Long Beach community. The food bank's mission is to provide highly nutritious food to the community's hungry residents and to ensure that no individual goes hungry, not even for a single day. A lot of time off at work and I am kind of on a leave so to make ends meet, you know, between month to month since I'm kind of unemployed right now, it's been helpful.",subjective
@magikalsistar62_video_7083763374659538218.txt," So can you please share what you're insecure about? I'm trying to prove a point. Housing. It's most definitely housing insecurity. I became a leader of the homelessness union for a organization in my state, because I've always faced housing insecurity. And so I started to use my voice and speak up on that and fight for the rights of people in my state. Now, this is going back from childhood. I was on my own at 16, and I started to struggle with issues like this back then. Once I became a mother, I was a little more stable for a while. But then it happened to me years ago, about four years ago. I was homeless with my kids for two years. We lived in hotels, and we lived in shelters. After that experience, and once I started to get on my feet, I decided that I was going to fight for the rights of anybody that's facing issues like I do. And that's when I found out that there's a lot of people dealing with housing and securities. And what do I mean by housing and security? If you don't know, housing and securities are for everything from not being able to pay a rent, worrying about paying rent, not being able to find a new place to rent, not being able to get a loan for a home or put money down on a home. Homelessness. These things are affecting more people than we know. But if you look into it, you'll find out that in my state, New York, there are over 100,000 people homeless. And despite my best effort, which I was doing everything right, I didn't fuck up, I didn't do anything wrong, it wasn't a bad tenant, I wasn't behind on my rent. And I'm getting evicted because my landlord sold my building to a company that wants to tear my house down so they can make a parking lot for another apartment building, an affordable housing apartment building. And although I know that that is very much needed, the way they're going about it is affecting people. And so laws need to be changed in our state. And all over the United States, especially rent prices, it needs to be a cap on rent prices. Because right now, I'm being evicted and I have to move, but I can't find a place because I can't afford the prices. I can barely make it by paying $1200 a month. Now I'm facing $15 to $7,300 a month for a rental property. Start to look into buying a house. I have to come up with a down payment for that house. The mortgage on the houses that I'm looking at are significantly lower than any rental property that I'm looking at. And a lot of people are renting out properties like this for twice to triple the price, which is fucked up and leaving people on the street.",subjective
@samanthasparksstl_video_7173722088866417963.txt," If you are worried that your car is going to be repossessed, remember that the number one rule is that they can't breach the piece. I'm Smith Asparks, and I see under repolas for breach of peace all the time. Unfortunately, coming in the middle of the night and picking up your car without interacting with you probably isn't breaching the piece. The law you are thinking of is probably the FDCPA that says that they can't communicate with you after a certain time. If they break into your garage, if they threaten you with violence, or even if they threaten to call the cops on you, that would breach the piece. Now let me learn more about your rights.",subjective
@akukulufamilytiktok_video_7150277081912446251.txt," SBA, small business administration, it does much more job or work than SBA DC. It's more small business development center. Well, small business development center, it gives you counselors, it has so many webinars, trainings and experts that support you from planning to launching and managing your business and growing your business. SBA though, it does similar job planning, developing and launching your business and also grow your business more than that. It gives financial help. You might get denied for any kind of loan from any private companies or banks, but SBA managed to give you a loan or grant so that you start your business and support your economy and the country and your community. SBA is a good source of financial support. More than that, SBA finds a way how to win a federal contract, meaning doing business with the federal government, how to do a contract with the procurement, with the federal government and also managed to win that grant and now job that the federal government needs you to do. It comes with money and the money is really good for your business. SBA also has, which is different from SBA DC, SBA has community navigators. They help you to do the same SBA job at the community level where you can understand where you can be reachable on a daily basis. SBA is utilizing community navigators so underserved underrepresented women, African-American women and women and also veterans and minority communities in general can benefit from SBA, contracting from a federal government and also doing business locally and internationally. So SBA is very useful for your business. Always visit the SBA to have Gav, make sure you create an account and have a point of contact. Good luck.",subjective
@glad_credit_video_7203392952385768750.txt," Look y'all, stop just sending out this few letters only. Do this too to get more deletions on your credit profile. A lot faster. You want to come to the CFPB Consumer Finance Protection Bureau. I want to submit a complaint. You want to make sure you're tracking your mail. So what you do is send your letters certified. That way you can actually upload the letters that you've sent in the proof of mailing that the credit bureaus received it so that you can have proof that the bureaus aren't doing their job. You want to come here. You want to click on credit room. You're going to come and click on credit reporting. You're coming click problem with credit room. The investigation did not fix an error on your port. You want to say, have you already tried to fix the problem? Yes. Here is you're going to write what you were disputing. If you were disputing factually, if you were disputing fraud, if you were disputing low-based challenges, you're going to write something up here to explain what took place. Here you're going to demand a resolution, which is typically removal of the negative account that you're disputing. Here you're going to upload your certified mail receipt with the letters that you send out, which will show proof of sending. You're going to give your identification like an ID and utility bill. And you're going to upload that as proof. And then we're going to send out. It's a company name that you want to dispute with. You're going to put experience. You're going to click all three. And if you wanted to dispute what other companies you can as well. After that, you put in all your info, send, and get the leashing.",subjective
@duhitsdani_video_7032519422799629615.txt, Safety tips as a woman taking public transit don't take the elevator. Someone may pull you in or push you in when you leave. Take the stairs. Pretend to take selfie to check your surroundings behind you. Don't walk like you don't know where you're going. Walk purposeful and with confidence. Don't sit next to someone waiting for transit. Sit or stand close to crowd. Sit in a semi crowded part on transit. Take first seat only so no one sits next to you. Place first or backpack in next seat and clutch it. Could use as a weapon if needed.,subjective
@feliseea_video_7246402774357871918.txt," Hey, I put together a list of all of the consumer protection agencies that you can reach out to and complain if you have an issue with insurance or being billed for something you didn't sign up for or all kinds of stuff I went through all the comments got everyone's suggestions and I put them in one list The list is by no means comprehensive. There are a lot of government agencies and some of them are state-specific So you're gonna have to do a little bit of homework to find the right place But I gave you a place to start if this is still too overwhelming for you I suggest you look for your state representative Contact them you'll be surprised how fast their office gets back to you and they'll help you find the right Federal will or state or whatever kind of regulatory agency that can help you if you have anything that I should add to the list Let me know in the comments and I'll put it in there because I am no in no way an expert on this I've just googled it so thanks",subjective
@kslcomnews_video_7290667905799179550.txt," A new report details economic and demographic trends in Utah. KSL.com reported how these trends are shaping a new Utah. The first of these trends shows Utah steadily growing since 2010, Utah has grown from small size to medium size, jumping states like Iowa, Arkansas, Mississippi, and Nebraska. The state's population is also older. From 1980 to 2020, Utah's median age increase from 24.2 to 31.3. Utah's people are aging better in Utah due to strong healthcare systems, but it can also be attributed to the declining fertility. Utah's also becoming more diverse, nearly one in four Utah's as a racial or ethnic minority, with that total projected to be one in three within the coming decade. One of the largest issues looming over the state is the lack of affordable housing. Hawaii, California, Massachusetts, Washington, Oregon, and Colorado are the only states with higher median single-family home prices. Find out more from Utah's number one source for news, KSL.com.",subjective
@cnetdotcom_video_7267633610285436203.txt," Here's how to use your phone as a hotspot when you don't have Wi-Fi access on your computer or gaming device. Using a hotspot with a laptop, a PC, or a gaming device is super simple. Check with your phone carrier to see if you're eligible for a hotspot. I'm using my iPhone SE with T-Mobile. Make sure your phone has a name you can recognize like Stephen's iPhone SE, for example. Go to Settings and scroll down to Personal Hotspot and toggle on Allow Others to Join. Below that, you can set a personal Wi-Fi password to secure your hotspot. If you're using a device that's signed into your iCloud account, you don't need to enter the password. To connect, go to your Wi-Fi settings on your laptop or gaming device, locate your phone's hotspot, enter your password, and connect. You will now be connected to the internet using your phone's data. You can also connect your hotspot by simply connecting your phone with a USB cable. Plug in your phone, choose your hotspot, and you're surfing the web. You'll have Wi-Fi on long road trips at the beach or in emergency situations like loss of power or in evacuation.",subjective
@no.otherr__video_7358839314861673771.txt," Hey, they recruited Rich Tallah to me this morning advising that they're still hiring with Care Net Health for the patient care coordinator position. The pay does go up to 17. She said you must negotiate to be advised of that pay. Also they do offer night position and overnight as well as overnight training. So y'all want to run okay. Run. You will be required to complete an assessment. I can't assist with the assessment. Shoot me an email. My email is found in my bio. You want to run okay. I will drop the link for this in the comment section.",subjective
@lindsay.fleminglpc_video_6812349921031703814.txt," Generalizing ZIDI disorder known as GAD impacts females twice as much as it impacts males. Symptoms may develop in early childhood, usually around age, eight or nine, however it can come throughout the whole lifespan. To receive a diagnosis of GAD, you must meet the criteria listed on the side. The symptoms mostly present for more days than not for the past six months. These worries are excessive, persistent, unreasonable, meaning that they don't go away, they get stuck in your head in their bigger than what we should really be feeling given this recurrent situation. This worry feels out of our control, we try to stop it and we can't. Adults must have three more of the symptoms below where children only need to meet one of the requirement. Where is our general of everyday things? An example of this would be like if you were scared to answer a question in class, even though you knew you knew the right answer. The worry doesn't match the situation.",subjective
@ketv7newswatch_video_7348163222853160235.txt, We had a lot of bystanders and civilians that were trying to come out and see what was going on so that decision was made at that point for the safety of the public that we had to put the sear down. We had to shut down 33rd street where we had to stop the traffic flow but it sounds like it was run around here a little while before we could corral it.,subjective
@momofmymom_video_7288471680991677739.txt," Hey, let's talk about the necessary documents that your loved one needs as soon as they have a dementia diagnosis. If you wait until they are unable to sign their name or recognize family, you will need a conservatorship which is a much more expensive and cumbersome process. So start early by meeting within a state planning attorney to get started on a wheel. A living will or advanced medical directive, a financial power of attorney and a health care power of attorney. Once you have these, keep them in a safe, easy to find place. The original can even be kept at the law offices that you have them drawn up at. Caregiving can be stressful, so limit your stress by taking care of these important documents. ASAP. Bye.",subjective
@sarahfranzlife_video_7099846179910847786.txt," Yes, I do love outschool. Aschool is one of the best platforms that I've ever taught on. I love the flexibility, I love the freedom, you choose your rate, you teach whatever you want to teach. That can be academic or non-academic just based on your experiences and based on what you were passionate about. You don't have to have a degree to teach without school, but it is important that you have some type of experiences or some type of expertise to back up what you're teaching. Go to my profile to apply. You can also DM me on Instagram for any other questions or any help and I can help you through the process. Just let me know. Hope that helps.",subjective
@alexbabii97_video_7332562963154488618.txt," Hey, what's up, you guys? It's Alex and this is a little bit of a different view because we're outside. I am going to do a food bank haul for you guys. Okay, I go to the food bank. I don't talk about it, but I feel like instead of just telling you the food bank doesn't give you the healthy food you guys think it is. I'm going to show you. So here's a food bank haul. We got some potatoes. Some of them are bad. We'll just have to peel around it. Two sweet potatoes. It is February 2nd for reference because it is on my break that I'm recording this. We got this little lunch box, killing the sandwich and a cookie that went out in January 29th. We got three frozen meals. A bag of sweet potato fries. They're bag of sweet potato fries. We'll applesauce pouches that you see bellies all the time. A bag of sweet potato fries. A bag of chicken fries. This super food thing and this premier protein shake. Shaving cream. Sorry guys. Chicken leg quarters. Three of these kombucha drinks. This egg salad sandwich that went out January 31st. This egg salad sandwich that went out January 31st. Two boxes of cereal. I'm going to flip it around for the rest because we have to bring our own container to get the food. I don't want to take all this out and put it back in a carat in the house. Four of these synodus cookie mixes. Two cans of pravioli. Two of these Frank Red Hot SpaghettiOs. Three cans of corn. Three cans of corn. And a little packet of coffee. And that's it. That's what we got. And I am so so thankful for everything they are able to provide my family when I am between Page Hicks and can't afford to eat. But a lot of people think that food banks have fresh produce and fruits and that's just not always the case. So I hope you guys enjoyed and I hope you guys have an amazing day. I'm not sure when I'm going to post this because I'm still my break. But I love you guys so much. Have an amazing day.",subjective
@wallyrashid_video_7276973494045314346.txt," If you do scientific research, especially systematic reviews and you actually enjoy doing it and you need some side money, I have a solution for you, give this a listen. I spent my entire life in academia so I can definitely understand money can be tight. I left medicine like six months ago to start my online business and a big part of having an online business is you need a blog. Basically you need a blog to rank on Google and the more blog posts you have, the better chances you have at ranking. Here's the thing, I always thought that blog posting is like creative writing, you're writing a story, it's like some sex in the city on her computer thing, not the case whatsoever. Same exact method that you do to figure out a research question, finding a very, very niche topic and then answering one very, very specific question. Same exact thing with writing blogs. If you're wondering what's the data, the data is literally right here. So this is Google keyword planner, you can actually get this for free, you just set up a Google ads account and this comes with it and you don't need to pay. Just search up any random word, I just searched up unique silverware. And if you look through, it'll literally show you similar words, their average monthly search volume and look at this, their competition level. If you're consistent with that for several months, you're going to start generating a lot of money because Google is going to start viewing you as an authoritative figure on that very niche topic. I'm talking about thousands of dollars every month. I'm super passionate about this so I can share a lot more on the topic if you're actually interested, let me know.",subjective
@cofi_la_more_video_7324368923913162030.txt," ¿Qué hago si se me perdió el social de mi bebé? Bueno, lo que tú vas a hacer es exactamente lo mismo que te haría si se te perdió tu social. Vas a ir al Social Security Administration Office y lo vas a poner en Google, ahí lo vas a buscar en tu mapa donde sea cerca de mí. Social Security Administration Office, cerca de mí o near mí o como tengas el ser indetus celular. Ahí te vas a salir, ya yo les enseñé cómo buscar eso en el video anterior, pero si no lo habéis, pues les digo aquí. Voy a salir la oficina que te queda más cerca. Entonces tú vas a ir, hay dos maneras de hacerlo. Para cualquier trámite que tú necesitas de hacer tienes que entrar y tienes que sacar un número. Hay una pantalla ahí, entre a la oficina le dices al de seguridad porque tú no puedes entrar ahí sin decir la de seguridad. Eso ustedes van a entrar, le dices, voy a entrar por este trámite. Entonces tú entras, ellos te van a dirigir hacia qué pantalla ir. En esa pantalla o en esa cabina o como tú le llames, ahí tú vas a tener que sacar un número, sacar un número y sacas para qué. Nuevos Social Security, se me perdió el Social Security. Entonces tú vas a preciar la opción que dice, se me perdió el Social. Tú puedes tramitar eso ahí mismo en la pantalla sin tener que pasar a ventanilla con una persona. Tú pones ahí, se me perdió el Social y pones, ahí te van a hacer preguntas en la misma ventanilla. Tú terminas y ya eso te va a llegar a tu casa y te puedes ir a tu casa ahora. Si tú quieres para mayor seguridad, tú puedes sacar un número, esperar a llegar a ventanilla y ahí mismo ellos te van a ayudar a hacerlo para que te llegue a ti. Eso es algo muy fácil de tu hacer, no creas que va a ser difícil. Hay muchas, muchas que me escriben al DM que me dicen, yo soy muy, hay una muchacha que me dijo, yo soy muy dunda para esas cosas. Hay chicas que dicen, eso es muy difícil, no es difícil, es súper fácil. Y es en cuestión de un día y de minutos, solo le recomiendo de que al Social Security lleguen temprano porque las oficinas son muy pequeñas, al menos en mi estado, no sé en el suyo, pero son muy pequeñas y hay mucha gente, así que llega lo más temprano que pueda llegar. Mi social me llegó con mi nombre mal escrito. Entonces yo personalmente tuve que ir a hacer eso. En el caso mío, yo fui, busse en la pantalla, que mis nombres, porque ahí es opción también en la pantalla, que mi nombre estaba mal escrito. Entonces yo fui, busse en la pantalla que mi nombre estaba mal escrito y coloque mi nombre bien escrito y me llegó a la casa, no cuesta nada, si estás preguntando, ¿cuánto cuesta sacar nuevamente al social? Porque se te perdió que no cuesta nada, a reglarlo tampoco, no cuesta nada. Ahora lo que no puedes hacer, porque suya es un trámite legal, es cambiar el apellido. En el caso mío, a mí me habían escrito mal el apellido, creo que el nombre, no me acuerdo, porque hace mucho años. Pero me habían escrito mal uno de esos dos, el mío, el mío, no le me decimo el mío. Entonces yo fui para que me los cambiaran, ahí en la misma pantalla hice para que ellos me los cambiaran. Si ese es tu caso, tú lo único que tienes que hacer es lo mismo, vas para que te lo cambien. Hay unas personas que me preguntan, ¿cómo hacer para cambiar el apellido? Eso es un trámite legal, no es lo mismo que tú cambies, de lópes a martines, a que tú cambies la s de lópes a zeta, porque tal vez tú has pedido con zeta y no con ese. Veis, es una diferencia. Entonces, ahí es que se equivocaron y lo puedes ir y lo puedes hacer. Para los que quieres saber si se me perdió el social, me van a dar un nuevo número, no. El número que te va a nadar es el mismo, lo que te van a mandar es la cartita, la carta del social, es la que te la van a mandar a tu casa. Bueno, amigas, yo sabía que me van a hacer esta pregunta y dije, ¿a qué les digo de una vez? Pero bueno, qué bueno que me le hicieron, espero ver respuestas su pregunta y si tienen cualquier otra pregunta. Y yo sabía que la respuesta con mucho gusto se le respondo un besito.",subjective
@MS4wLjABAAAAtUWuRxxxwoaCb2659sECxjGF0mt6Vga6jMxmhcrSV4SKy7zYBA57_38ipyc7jTUm_video_7354464481805716766.txt, I love this 3 year old brand got anła Yeah i love them Ahh Bill I'm not sure if I can do it. I'm not sure if I can do it. I'm not sure if I can do it. I'm not sure if I can do it. I'm not sure if I can do it. I'm not sure if I can do it. I'm not sure if I can do it. I'm not sure if I can do it. I'm not sure if I can do it. I'm not sure if I can do it. I'm not sure if I can do it. I'm not sure if I can do it. I'm not sure if I can do it. I'm not sure if I can do it. I'm not sure if I can do it. I'm not sure if I can do it. I'm not sure if I can do it. I'm not sure if I can do it. I'm not sure if I can do it. I'm not sure if I can do it. I'm not sure if I can do it. I'm not sure if I can do it. I'm not sure if I can do it.,subjective
@lisaremillard_video_7289171995596737838.txt," If you're one of the 71 million Americans who receive Social Security or SSI benefits, or you know someone who does, you're going to want to pay attention to this because those 71 million people are about to start saying a little bit more money in their monthly check. Today, the Social Security Administration announced Social Security and SSI recipients will be getting a 3.2% COLA increase. COLA stands for Cost of Living Adjustment and By-Law Every Year Based on Inflation, Social Security recipients get an adjustment to their benefit. Now before I get into what that actually looks like in dollars per month, I want you to know that I'm going to be emailing out this notice of COLA increase in my news girl news round up email tonight. So make sure you sign yourself up. And even if you don't receive Social Security, I'm sure your parents or your grandparents do, and they're going to want to have this information. So if you sign yourself up for the round up, you can always forward it onto them. Now starting with the first payment in 2024, the average monthly Social Security or SSI check will be about 1900 bucks. That's up about $60 more per month than recipients were seeing in 2023. It's important to know this 3.2% increase is significantly smaller than the COLA increases we saw for 2023 and 2022. In 2022, the COLA increases 5.9% and in 2023, the increase was the largest we've seen in more than 40 years at 8.7%.",subjective
