File Name,Content,Subjectivity/Objectivity
@hananyanaftali_video_7245648518134631688.txt," When I joined the Israeli Army, they deemed, first of all, give me a weapon and be like, okay, if you see somebody that looks like an Arab, you know what to do. Of course not, but it's insane that some people actually believe these lies. Your first day in the Israeli Friends Forces, you get this small booklet that's called the IDF Code of Ethics. And it's called in Hebrew Guwah Zal, Spirit of the IDF. And if, first of all, learn how to behave like a human being, you learn how to treat your enemy. And only then, you are taught how to defend your country physically, actually. And I also served as a combat medic. So when you're a combat medic, you take an oath actually to treat your enemies. And I've done that. Actually 90% of the people that I've treated during my military service were not Israelis. They were either Syrians or Palestinians.",subjective
@gemsofshaykhuthman_video_7288471839397907754.txt," Many Muslims are confused about which Masjid is Majidul Aqsa. They have a picture or a painting of the Masjid behind me here and I will say Majidul Aqsa. And this is something dangerous because it makes us forget which the real Majidul Aqsa is. This Masjid behind us is not Majidul Aqsa. Majidul Aqsa is the whole compound but the actual Masjid is not this one. This Masjid is called Qubbatosakhra. It was built by Abdul Malikab in Marwan in 72 Hijri. This was built on a rock that many of the Aliah might have felt that this is the place where Rasulullah Salallahu al-Azallam went for his Salah on marriage. But it is not Majidul Aqsa in and of itself. Majidul Aqsa is on the other side of it. This which you are looking at, this is the actual Majidul Aqsa. And the danger of the Muslims not realizing that is if the Yehud or others tried to destroy this Masjid and people are so ignorant, they don't even know which Majidul Aqsa is the real Majidul Aqsa. Then people will show them pictures of Qubbatosakhra to say that it's okay while destroying the actual Masjid.",subjective
@holy_land_site_video_7294310814306061574.txt," We're welcome to the Holy Land and this biblical site of the pool of Bethesda and the church of St. Anne. This is where Christ healed an invalette man who couldn't walk absolutely amazing. These pools were right by the temple mount, so just amazing to think about what Jesus did here. The pool of Bethesda is located on the property of the church of St. Anne. And the ruins of the Jewish, Roman, Byzantine, and Crusader eras are still well preserved at this pool. This is the base down here where the pool was actually at and where Christ healed an invalette man who had been going there for 38 long years.",subjective
@shift_alt_delete_video_7356458731095346478.txt," were boycotting Estay Lauder. I don't think y'all understand how bad it is for Estay Lauder and all the brands they own. The chairman of Estay Lauder is Ronald Lauder. And he's a really bad guy. He's the chairman of the Jewish National Fund which literally ethnically cleanses Palestinians from their homes. 45 JNF parks sit on top of 89 Palestinian villages. And they are currently targeting Palestinian bedwins, showing up with bulldozers to their farmlands. And his work doesn't stop there, he's also the president of the world Jewish Congress. A pro-Israel propaganda machine which accomplishes this through public policy and diplomacy around the world. JNF and world Jewish Congress directly go into the ethnic cleansing of Palestinians, the stealing of Palestinian land, and the mass murder of Palestinians. Supporting any of these companies means that you're directly supporting that. And I need y'all to take this way more serious than you are. But I didn't know, well now you know, and go ahead and tell your friends and family. But I'm just one person boycotted doesn't work. Guess it does. Do you want to be funding the genocide of Palestinians? I don't think so. He also threatened to cut off donations for you Penn for hosting a Palestine literary festival. That means no Mac. Bobby Brown. Clinique. Lay Lobo. The ordinary. Two faced. Avida. Dr. Jar. Glam Glow. Smashbox. And if you don't believe me, go ahead and check out the website. They literally have every single one of them listed. Okay. Thank you. Keep boycotted. Free Palestine.",subjective
@middleeasteye_video_7276514789084433697.txt," It is painfully clear that the prospect of creating a Palestinian state alongside one that defines itself as Jewish is zero. There are 700,000 settlers in the West Bank in East Jerusalem, and not an Israeli politician or movement in sight who is prepared to remove them. Quite the contrary, annexation exists at two speeds, creeping annexation tolerated by a broad spectrum of the Israeli political elite from the centre to the right, and annexation tomorrow as proposed by the National Religious Movement. This force is in the driving seat. So why does the international community continue to advocate for a two-state solution? When the Orslo Accords have essentially become unattainable? The short answer is that while Oslo is a path to peace is clearly dead, as a formula for maintaining the occupation, Oslo is alive and well. Just think for a moment, what would happen if Oslo were abandoned? The Palestinian President would resign and call elections. Those elections would be free and fair. Neither Israel nor Washington could cast a veto over the process or the outcome. Fatter would probably lose in the West Bank, but could win in Gaza. It would soon become clear that the best hope of all the Palestinian factions would be to form a government of national unity. But Palestinians would actually have a leadership, they elected. Not only would the PAB reinvigorate it, but so too would all the other bodies whose life has been sucked out of them. The PNC and the PLO. The new Palestinian leadership would stop security cooperation with Israel, which is a euphemism for letting soldiers undercover squads roam all over the territory that they control. The forces under the PAs control could then come face to face with Israeli soldiers and settlers, especially if the PAA did its job and actually defended Arab towns from settler attacks. Israel would have to start treating the PAA with respect. Not simply as another arm of occupation. If Oslo were abandoned, the international community couldn't threaten to cut off PAA funds because they would be damaging the formation of a Palestinian state, which they then would have to recognize. Now, do you seriously see all that happening? I for one don't. And that's the answer to the question of why a two-state solution still lives on in the bosom of every government in Europe, and the US and around the world. But let us be clear. Oslo exists today not as a peace process. That can only come when the occupation becomes too costly for the occupiers. Only then will they start to negotiate. When that happens, there can only be one solution. One state for all its peoples with equal rights, only then will the occupation, the nightmare of occupation be over.",subjective
@judeanceo_video_6892089774769704197.txt, I'm time and I wanna spend some time with you Just the two of us We can make it if we try Just the two of us Just the two of us,subjective
@npr_video_7350363254440430890.txt," The biggest Israeli city attacked on October 7th is now coming back to life. You see signs all across the city, guess who's back? This is in front of a school. That's back in session. StayRote is the closest Israeli city to Gaza. And on October 7th, Hamas attackers invaded the city, killed more than 50 people here, nearly everyone in the city evacuated. A couple weeks ago, the city reopened its schools, and 70% of the city came back. But life is not yet back to normal. Soldiers are guarding every single school. Classes are held in reinforced bomb shelters. We watched the fourth grade teacher teaching a class on what is trauma. We met sixth graders who are still shaken from what they lived through on October 7th. And now the students are back in their city and they're hearing the bombs and the gunfire of Israeli troops across the border in Gaza. There is a hilltop look out here with a viewfinder where you can actually peer into northern Gaza and see homes demolished by the Israeli military. The majority of Palestinians fled northern Gaza. So unlike here in the Israeli city of StayRote where people are coming back, across the border, Palestinians cannot yet return.",subjective
@good__point_video_7330077212210711809.txt," This comes within days of the ruling of the ICJ, the Supreme Court of the World. And the president of that court made it very clear in issuing these provisional measures. And that's not just Israel, it's all the 150 state parties to the genocide convention. They are in violation of that convention if they're going to impede the delivery of humanitarian aid. And what is happening now is that it looks like these Western states are complicit in the violation of that convention. And the United Nations from Antonio Gutierrez down needs to recognize this is a political attack. And they need to step up to the plate and defend unrest, mandate, and its historic responsibilities.",subjective
@tima2930_video_7298747558426512686.txt, Did you know that Shimon Peres? The former Israeli Prime Minister was a refugee in Palestine and applied for Palestinian citizenship seeking agricultural work.,subjective
@makeupandmuscle_video_6860622098860084486.txt," So what's up guys if you guys don't know what's going on we're living in biblical prophecy and it's unfolding right in front of us the The peace treaty with Israel was signed today which is biblical and we all know that we are ending the seven-year Tribulations so I am urging you guys okay once this first treaty gets signed the anti-Christ is gonna come and Reestablish this treaty and make it stronger and then the beginning of the temple is gonna be built now in the Bible What that means is the anti-Christ is coming very very soon within our lifetime Okay, so it's extremely important right now if I urge you guys to do anything if I urge you guys to do anything It's a good relationship with Jesus Christ get as close as you can with him before the time is too late the time draws near God is coming Jesus is coming. There's a spiritual awakening Please Establish that relationship with God before it's too late",subjective
@rapidhistories_video_7350494190175931653.txt, TIPS,subjective
@escapingfromcity_video_7292645344515673390.txt, N you you you you you you,subjective
@longriver2_video_6984259746245152006.txt," We are proud of the role that we played in the creation of the State of Israel, and we will certainly mark the centenary with pride. This was what Theresa May had to say about the 100-year anniversary of the Belford Declaration. But what exactly happened on November 2nd, 1917, and what was the Belford Declaration all about? These 68 words were a historic promise, given to the early Zionist movement by the British government for the establishment in Palestine of a national home for the Jewish people. Sir Arthur Balfour, then foreign secretary of Britain, wrote in a public letter to a famous British Zionist, Lord Walter Rothschild, which read, His Majesty's government views with favour the establishment in Palestine for a national home for the Jewish people, and will use their best endeavors to facilitate the achievement of this object. It's being clearly understood that nothing shall be done which may prejudice the civil and religious rights of existing non-Jewish communities in Palestine, all the rights and political status enjoyed by Jews in any other country. This was just what the Zionists were looking for, as outlined in the first Zionist Congress during its meeting in Basel Switzerland in 1897. Zionism seeks to establish a home for the Jewish people in Palestine secured under public law. Earlier, Theodor Herzl, their founder, had failed to realize this purpose when he couldn't get support from the Ottomans or any other European ruler. But this declaration basically laid out the foundation for the State of Israel, and since the second part of the agreement, we're talking about protecting the civil and religious rights for non-Jewish communities in Palestine was never implemented, it resulted in a great injustice towards the Palestinian people, as thousands of them lost their homeland with the creation of this new Jewish state, and the ones who remained are being treated like second-class citizens. I think the late British author and journalist Arthur Coester summed it up best when he said one nation solemnly promised to another nation the country of a third. What were they thinking? Well, you see, Great Britain was in the midst of World War I, and one of its biggest foes was the Ottoman Empire. So they employed the tried and tested strategy of divide and conquer. They were giving the Arabs the promise of complete and final liberation and returned for rebellion against the Ottoman rulers. The crown had decided palestines for the Jews, thus ensuring a perpetually divided Middle East, and 31 years after the bell for declaration, the State of Israel was founded. But it's not 100% certain that this was the initial goal of the British government. The results have brought devastating consequences to the Middle East. It paved the way for the longest military",subjective
@myhomeofzodiac_video_7305311299808824609.txt, We,subjective
@fatha7lah_video_7310324819416059142.txt, وسأل نجوم اللي لها الزارة الكراء جفمي وكيف يزور من لم يعرفي لغر وإشححت بغب ضجفونها عيني,subjective
@chir0n92_video_7312172894279273774.txt," You guys have to go follow this guy, watch this video, download it, screenshot the parts that you need to read in order to learn the history about this. I've been waiting for this guy to make a video about this for what feels like too long. And here it is. He's one of the most thorough, hardworking content creators in the internet and he's really good at editing videos. I apparently only follow 15 people on this app so go check my followers, he's one of them, go follow him and get your learn on, buckle up. The internet is single-handedly taken down the entire Zionist propaganda apparatus that has been at work for 100 years in a matter of months and it's pretty awesome.",subjective
@buildersofmideast_video_7296084178540432641.txt," Did you know that it is only one time in the history of the world where Israel and Palestine actually made peace? That's right, the Palestinian leader Yasser Arafat shook the hand of the Israeli prime minister Yisra Krabim in front of the entire world and they agreed on peace in the Middle East. It happened 30 years ago in 1993. No one invited both sides to Oslo and they started negotiating. For the first time Palestine recognized Israel and Israel recognized Palestine. They started working out on the details, orders, refugees, business between the two countries, security for both the Israelis and the Palestinians. It was going so well they signed another peace treaty in 1995. Yasser Arafat received together the Nobel Peace Prize. For everybody around the world that was it, peace was on the way until something terrible happened. An extremist in Israel took the life of the Israeli prime minister, then Palestinian extremists jumped on the occasion and started terror attacks to cause more chaos. This trust between both sides started rising and eventually the Oslo agreement was put on pause forever. This story is full of sadness but it's also full of hope. It shows that what most Palestinians in Israel these actually want is peace. It's the extremists, the Palestinian extremists and the Israeli extremists who want to destroy everything and who only care about themselves that are responsible for the war. This handshake that happened 30 years ago is proof that Israelis and Palestinians can see eye to eye and respect each other. It's proof that there are people who believe a Palestinian state and an Israeli state can exist together. It's proof that peace is possible in the Middle East.",subjective
@cbsmornings_video_7086926931144297771.txt," Breaking overnight, violence at a holy site in Jerusalem for Muslims and Jews has injured more than 150 Palestinians and three police officers. Israeli police battled rock-throwing youths at the Al-Aksim mosque also known as Temple Mount. Thousands of Palestinians had gathered for Friday prayers in the middle of the Holy Month of Ramadan, which falls this year at the same time as Passover in Easter. A similar clash at the site last year led to an 11-day war between Israel and Hamas in Gaza.",subjective
@justgraciegrace_video_7293875046454529313.txt," Okay, so back on up kitty cats because there's a lot of things that we need to cover for the resolution of this report. This is gonna be a long video, so if you want to speed up the video, if I start rambling, or if you have the attention spawn of a toddler, but I will start by talking about what was at the end of the report, like the suggestions from the mission. If you don't know what I'm talking about, please watch this video that I made a few days ago about the Goldstone Report. I will be quoting a lot of this document because unlike the Israeli government, we like to come up with receipts and everything that I'm talking about in this video will be in the shmink in my profile. The Goldstone Report is available in multiple languages. It's available in Arabic, English, French, Spanish, Russian and Chinese as well. So if you want to download all of that, again, it's in the shmink in my profile, but without further ado, let's go. So at the end of the report, the mission gives recommendation to the United Nation as well as the Human Rights Council. I'm just gonna read a few sections and then we will go to the resolution. So there was a meeting that was held after this. And yeah, that's what we're mainly gonna talk about today. But so in the Goldstone Report section 1969 to the United Nations Security Council, a, the mission recommends that the Security Council should require the government of Israel under Article 40 of the character of the United Nations. One, to take all appropriate steps within a period of three months to launch appropriate, appropriate investigations that are independent and in conformity with international standards into the serious valuation of international human humanitarian and international human rights law reported by the mission. And any other serious allegations that might come to its attention to to inform the Security Council within a further period of three months of action taken or in process of being taken by the government of Israel to inquire into investigate and prosecute such various valuation. The mission further recommends that the Security Council should at the same time establish an independent committee of experts and international humanitarian and human rights law to monitor and report on any domestic legal or other proceedings undertaken by the government of Israel in relation to the aforesaid investigation. So I'm not going to read the rest, but in a nutshell, they are asking separate investigation from each part. So Israel as well as those who were in power at the time in Palestine to investigate what happened between December 2008 and January 2009, I believe. Now mind you that Israel refused to partake in this mission and therefore after that they're claiming to be an anti-Israel biased report, but then they didn't want to partake in any whole let me just come up with facts because then the UN did a general assembly assembly debate on first day November 5 2009 3pm in New York. In this assembly, every single member needed to vote in favor or now of the resolution of this mission. So like I said, asking Israel and Palestine to do independent investigations and then come up with report so then they could further more investigate and come up with a final resolution. A lot of people were in favor of the recommendations that were pointed out by the mission. So I'm not going to give all the countries, but I want to give the countries that were against it. Australia, Canada, Czech Republic, Germany, Hungary, Israel, Italy, Marshall Islands, Micronesia, Nauru, Netherlands, Palau, Panama, Poland, Slovakia, the former Yugoslav Republic of Macedonia, Ukraine, the United States of America. Are we surprised? I'm not surprised. Anyhow, before and after the vote, some of the members were able to back up their vote. So basically explain why they decided to vote in favor of staying or refuse the resolution of this act. And one thing that I wanted to highlight is what the Israel representative said. I would like to take this opportunity before the assembly proceeds to the vote to see clarification on on an element contained in operative paragraph four of draft resolution, which is a matter of concern to us and I suspect to other delegations as well. More specifically, we would like to ask who exactly will be the accountable, quote unquote, Palestinian side that would be responsible for undertaking investigations that are independent, credible and in conformity with international standards. Would it be the Palestinian authority that was ousted? Sorry, I don't know how to say this. From Gaza in a violent coup and is now effectively present there, or would it be the Hamas tea organization tea tea entity, which violates every international standard promotes tea, rejects the recognition of Israel and tries to derail the region from the track of the peace process. Israel, through your sir, would like to ask the sponsor of the draft resolution to clarify this critical aspect so that member states of the general assembly will know better, will know better what they will be voting for. The president, I give the floor to the representative of Egypt who presented the draft resolution on behalf of the Arab group and the non-aligned movement. And so the Egyptian representative said, with regards of the operative paragraph four of the draft resolution, the Palestinian authority itself declared that it is going to conduct its own investigation, which is independent, credible and in conformity with international standards. And Hamas, which may be considered an Israel as a tea organization, but is considered the legitimately elected representative of the Palestinian people, has already expressed its willingness to cooperate and to investigate to persecute those that are responsible for such crimes. We would like to hear the same from the representative of Israel. If he can confirm today that Israel is willing to undertake investigation that are independent, credible and in conformity with international standards, international law and international humanitarian law, I think this would be very news to general assembly before voting on the draft resolution. Yeah, and then the conversation goes on and more members defend their vote basically. It's a lot of countries that were in favor. So that was the final resolution that Israel and Palestine need to do their own separate, unbiased investigations. And I just wanted to highlight a few things that some of the state members said. Some of them are very long, but this one is short and it's coming from Malaysia. Malaysia voted in favor of the resolution 6410 because we strongly feel that Israel, the main perpetrator in the Gazan conflict, should be held accountable for the war crimes and gave violations of human rights and international humanitarian law, which it had committed during the conflict. In fact, we would have wanted stronger language in the resolution to reflect this view so as not to equate the victims with the perpetrator. Malaysia has always been that girl. Let me tell you. If you want to read all of that, it's available in a shrink in mine profile. And then in the next video, I will talk about the drama that happened after that and also what was the full conclusion of this report and why no actions were taken.",subjective
@controversialtalks96_video_7311320955706412321.txt," Do you speak English? Yes, I do. Did most of the people living here have they been evacuated? I don't know. I don't know. One of the things that you did is evacuated. It's evacuated. So what are you doing here? I was hitting it. You're going to hit the cat. It's very nice. Actually I live here with you. You're just, I don't have a small children. That's why I can't live here. Oh, so I've run with children. I remember that. No, I'm sitting next to you, actually. I've seen some old people walking around. Some old people, yes, some old people. But that's why I'm so seen. You like to see the old people walking around. Oh, you got like a baby. I'm not a kid of a year. I'm a kid. I have to work. I work in a machine. That's why I returned from a vacation to New York. I'm here and I need to be a busher. It's scary here. I've been here a lot. Yeah, yeah. I've heard this the whole time. There was alarm, and I've seen this. You got used to it. That's the weirdest thing I guess. I can't use the rock in the front. It's a reality. It's coming here just to feed the cats. That's not the sweetest thing I've seen all day. I don't know what is.",subjective
@designsbydebbieokc_video_7236245036013260075.txt,,
@theayecutiechannel_video_7198389794697858350.txt, استوضیره pirzer مده seas اذا habérًا تقصیم رانی؟ دو warfare ترگه تظر ما نفدxim  compassionate کرفد ا rho mosquitoes,subjective
