File Name,Content,Subjectivity/Objectivity
@chayoeverett_video_7357032355497839918.txt," Here's why it's nearly impossible to tell when the Rafa crossing or the Egypt Palestine border is going to close. First of all, Egypt is the only Arab nation that borders Gaza. That border at the Sinai Peninsula is the only border that's not fully controlled by Israel. So, in 1967, during the Six Day War, Israel took the Sinai Peninsula from Egypt. They also took the Golden Heights from Syria. Then, in 1973, Ann Warsadot, the President of Egypt, and Hafez Al Assad, the leader of Syria, they teamed up. And they went back to get the land back. The plan kind of worked. It kind of didn't. It worked for Egypt. It worked for Ann Warsadot. Egypt ended up getting the Sinai Peninsula back, but they had to recognize Israel as a country. And also established diplomatic ties. This was done in 1978 through the Camp David Accords, negotiated by President Jimmeth Carter of the U.S. of A. Syria, by the way, still does not have the Golden Heights back, but that's a whole issue. So then, after the Accords, the Egypt Gaza border was set up. And then, in 2005, the Palestinian Authority, the EU in Israel, signed the agreement on movement and access. Or the AMAs, also known as the American Music Awards. Anyways, after a certain person took power in 2007, things got bad. Excuse me, things got even worse. Basically, the Rafa Crossing has had a history of being closed more days than it's been opened. But the blame can be split between Israel, Egyptian government and that other guy. But the thing that you need to know is that historically, the Rafa Crossing has been hard to get through. Also, as you may already know, Palestinians are being extorted for money by Egyptian brokers for upwards of $10,000 per person, just to be put on an evacuation list. That their names might come off of for no reason and at any time. So, something that I really want to stress from this is that when we're talking about Israel and we're talking about the United States government, all that, all that, all that. Look at Egypt. Look at the Egyptian government because they have a hand to play in making it as hard as possible for Palestinians to get out. If you're interested, I'll have a video on my YouTube channel that goes more into depth about the 1967 Six Day War, about the 1973 October War, just because more into depth about all of it, everything from start to finish the Golden Heights, the Sinai Peninsula, all of it, mama, all of it. We go all in. We dish. I haven't even, I haven't edited the video yet, so I'm really talking this up. But let's go to the YouTube. Click the thing. You'll see it. You'll see it when you see it.",subjective
@rayenzoghlami2_video_7194147054082444550.txt," I'm the one. I'm the one. I'm the one. I'm the one. I'm the one. Foo. Foo. I'm the one. I'm the one. I'm the one. I'm the one. I'm the one. I'm the one. I'm the one. See what? See what? This is the campaign to fight any決iable citizens. If we could to fight together, we would have said somięcy. If we could to defeat each other, we would have said somenet. If we could take right and take right and take very too deep, we would also say that",subjective
@perry.ahamad_video_7316356114625482027.txt, didn't,subjective
@macisbackfun_video_7190109250646068486.txt,,
@stevenohi10_video_7291466924167367978.txt," The reason other Arab countries don't support Palestine anymore is because the United States paid them off. Egypt used to support Palestine and also because Israel kept invading Egypt, but the United States paid them off with the Camp David Accords. Since the 1970s, you can look it up yourself. The United States has been paying billions of dollars, 3 billion per year to Israel and 2.5 billion per year to Egypt, so that they will allow what Israel is doing. Egypt got bought off. Russia also used to be on the side of Palestine, but if you look at how much money we pay Russia now, and they will never stand for Palestine. If you look at any Middle Eastern country and just type in how much these United States pay them, you will see this is literally all money. It's about money. Here's another 400 million and another 20 billion to Jordan and to Syria 1.1 billion just this year alone, 16.9 billion since the start of the 12 year crisis. It's money. It's literally money that is keeping other countries from interfering on behalf of Palestine because this country, the United States pays them not to. I'm a historian with multiple degrees and I want people to know the real history. It's about money. We have to look at the facts and the figures.",subjective
@freedomfighter_65_video_7306572654465633582.txt," In sem seho gallar umeda in temame rečeč<|pl|> prosdjiblicalnoෞvenna brakva pl treats shejsa. Z цjaRE pitajočno locarno. To per navstč segosngav i pl metabol deputy sles var sva glемastCu honoru niezapranti uboko njeg prabe ter je pri cooks society s Obvijelike budite mempra Olga raho izbačitive. Film final, je živdoorse, ker njedežilo sel jas ocu sa uget Screen. Dajte čstva sn hasene. Huhaj,štoki, čstva pri Ahažidljhovih zb Boulder. Fac我們 pode hebben svaj z moododeni. Skupa zbeteš mrani. pixniki calkar산u hahaha s resih audijo��고 30. pam nowtersih Visaj種niji Remember We shared果, što Opportunizzoj na begljeg s солн jumpinga je, ratetak jeос naっていう lekno tou sal рыjredy? I情 verja se ni v nedeti ewoljite. Kravu je naenbene smashedal qompla, resp >>: Neljice jig je Recognika Šte zam stranja blカ ¨Trobu krated zditaňa midačin, mori je in zblubr bo scak Stage na razč baby ologod teg pa post teve kovo pa liem media če visualize tense okej ste leg ότι questa mat record, sam pr omega to ma rezvi Kajuc umjala da ne piena u negasj pe Code što kože kru skologistijam na palačnic 봐 proposal dull . Č keep sem naoga in ko je potihhme rebelva ml dortala? Čak je mada, kini ni Invalame. particle Je Ad prince. Nileš 1935 p 66 phenomena. Jak Ki je trebi? Njujem, pike se s nijame ljud funnyno uunningos tut. Ne kartili kolov then vrocij, nego tudi polega hiš da!",subjective
@itsnotpearl_video_7266997171034049834.txt, You think I'm crazy?,subjective
@israelcc_video_7342954813686091054.txt, ¡Vamos a la mano! ¡Soy por la mano! ¡Soy por la mano de 16! ¡Soy por la mano de 16! ¡Soy por la mano de 16! ¡Vamos a la mano de 16!,subjective
@khoirootun_93_video_7293454741072268552.txt, يا الله يا رحمة يا رحمة يا كريم عرفة بلنا مترى كنفة يكون هي قامترى هر شئ بي زكر ترى لا إله إلا الله يا الله يا رحمة,subjective
@bubblewhite117_video_7355471007727078661.txt, Hendry井 Taekwondo 후보끼리,subjective
@ririmh1234_video_7218327287907896581.txt, FANTASIA EUordan,subjective
@animal.recaps2_video_7289296829542305070.txt," The Iron Dome, developed by Israel, anti-aircraft missiles have been in the spotlight these days. The success rate of intercepting a missile is 90 percent, while Hamas fires 5,000 rockets in a 20-minute frenzy. Can the Iron Dome truly defend against such a relentless attack? An Iron Dome anti-air system consists of three key components. This is the Combat Command Center. There's also the Missile Launch Unit. The most critical part is this detection and tracking radar. The Missile Launch Unit can hold up to 20 missiles, deploying it near a city, is like putting a protective shield over the city. The Combat Command Center is responsible for intercepting incoming orders. Attacks are only initiated when rockets enter a designated range. This small interceptor missiles surprisingly can cover a range of 70 kilometers, even though it's only 2.8 meters tall and weighs only 90 kilograms. Now, pay close attention. Here's the key point. When multiple enemy missiles are fired at the target city, the Iron Dome Defense System activates. First, the radar can detect threats within a 100 kilometer radius. Then it transmits the data to the Combat Command System, which sends instructions to the Missile Launch Unit and tracks the trajectory of enemy missiles. Data is transmitted from the radar to the Combat Command Center. Once a target is detected within the protected area, interceptor missiles are rapidly launched and locked on to the target. When they get close enough, the front warhead detonates. Inside, it contains shrapnel that detonates enemy bombs. It's important to note that a single Hamas rocket costs only $80, while intercepting it with an Iron Dome Missile costs $50,000. That's a significant difference in interception costs.",subjective
@b3cky.dc_video_7080602635350461739.txt," Hmm, so what does it really mean when you say you want to globalize the intifada? Is it the facts that Justin the last week alone enough terror attacks were carried out in Israel to claim 12 Jewish Israeli lives? Is it the facts that synagogues in over six states in the United States were under bomb threat this week? Is it the facts that people are celebrating that? As you might expect the answer is all of the above! And this isn't me speaking out of my booty hole, this has happened in the past a few times! So I don't know, just think on that.",subjective
@militarytrends_video_7227895641509301509.txt," The Merkava Tank is an impressive piece of military machinery that was first introduced in 1979 by the Israeli Defense Forces. This beast of a tank is not just any ordinary tank, it was designed with a focus on crew safety and survivability. One of the most unique features of the Merkava Tank is its design. Unlike most other tanks that have the engine located at the back, the Merkava places the engine at the front of the tank, which provides additional protection for the crew in the event of an attack. The crew sits behind the engine, which acts as a shield to protect them from incoming fire. The Merkava Tank is also equipped with a powerful 120mm smoothbore cannon that is capable of firing a variety of ammunition types, including armor piercing and high explosive rounds. This cannon is incredibly accurate and can hit targets from several kilometers away.",subjective
@vumanchau946_video_7279753848737074478.txt," So of course, our considerable detail to come yet out of these documents and in letters that will accompany the documents, some stipulations regarding the various agreements and how they will be implemented. The document that calls for peace between Israel and Egypt specifies a very particular timetable which could produce peace between those two nations within a year and withdrawal to begin within two or three months. That agreement, however, is, as you heard earlier, subject to approval of the Kinesit regarding withdrawal of the Israeli settlements in the Sinai, which has been a very major sticking point and was one of the causes of the breakdown. I might say that the first document is quite comprehensive in nature and composing a framework by which Israel can later negotiate peace treaties between herself and Lebanon, Syria, Jordan, as well as the outline of this document that we will now sign. And as you will later see in studying the documents, it also provides for the realization of the hopes and dreams of the people who live in the West Bank and Gaza Strip and will ensure Israel peace in the generations ahead. This second document is one relating to a framework for a peace treaty between Egypt and Israel. And this is a document that calls for the completion of the peace treaty negotiations within three months. And I have noticed a challenge extended by these two gentlemen to each other and that they will complete within three months. I might say that this document encompasses almost all of the issues between the two countries and resolves those issues. A few lines remain to be drawn on maps and the question of the settlements is to be resolved. Other than that, most of the major issues are resolved already in this document. And we will now sign this document as well. As President Carter has said, he is going to go into a great deal more detail before a joint session of Congress tomorrow night. And it was expected that Prime Minister Vagan and President Sedot will appear before the Senate Foreign Relations Committee on Tuesday. At least that was the plan earlier today and before it was known that this meeting was going into night with this particular ceremony. If they stick with that proposed schedule, they will talk to the Senate Foreign Relations Committee and House Foreign Affairs Committee perhaps on Tuesday. Meanwhile, of course, each of these two other gentlemen will be appearing for their own news conferences and explaining their interpretations of the agreements. Thank you very much. And so after 30 years of war, the entire lifetime of the Osayra State and agreement for peace, at least for a framework for peace in the Middle East, it is indeed a historic moment. Marvin Cowd, from your vantage point of view, has seen your diplomatic correspondent what have they had to give up to get these agreements? What is it on there? Well, Waller, it's quite clear that there were major concessions that were made by both sides. On Egypt's sides, Sedot dropped his demand for a commitment now. The total is rarely withdrawal from the West Bank. The question of sovereignty over this disputed area is left open at least for the time being. The final status will be negotiated, they say, within the next five years. On Israel's side, it seems that Vagan has agreed to negotiate the removal of Israeli settlements from the Sinai once his parliament approves. He has agreed to freeze the building of new Israeli settlements on the West Bank, and he's agreed to return three major airfields in the Sinai to Egyptian civilian control. Now both Sedot and Vagan are left with the responsibility of selling those concessions to their own constituencies. And Bob Sheeper, from the White House, what did President Carter get? Did he get what he wanted? I would think so, Waller. You know, there are a couple of hooks on and all this. First, Jordan must agree to these arrangements on the West Bank, or you don't have much there. And the question of the Israeli settlements in the Sinai must be settled, or there can be no peace agreement at all. But still, it seems to me that this is going to be seen as really a remarkable achievement for the President. Just look at two weeks ago what the situation was. Peace process, all but dead. You bring people together in a situation unlike we've ever had before, truly an extraordinary event. And tonight you have these two people talking about signing a peace treaty between Israel and Egypt. It was a high stakes venture. They called it that at the start, well tonight, from what we know about it. We haven't seen the documents yet. It appears that the President won, and he won big. And tomorrow night he goes before a joint session of Congress at 8 o'clock Eastern time to report to the Congress and through the Congress, to the people on what he accomplished at Camp David. And we expect to hear more from Prime Minister Began and Egyptian President Sadat tomorrow as well. This is Walter Krongey, CBS News, Washington. This has been a CBS News special report from Washington.",subjective
@slavicamir_video_7231221946409635077.txt, Твою маму мы убили и блесально могили,subjective
@enterthereality_video_6963249631136451845.txt," If you can win this war, if the United States will come in as your ally. The United States was not in the war that time. We were fresh, we were young, we were rich, we were powerful. They told England, we will guarantee to bring the United States into the war as your ally to fight with you on your side if you will promise us our time after you win the war. In other words, they made this deal. We will get the United States into this war as your ally. The fight you must pay up is power seeing half you of one the war and defeated Germany, and you will have your hungry and certain.",subjective
@officialfaqts_video_7358148735303552302.txt, Here you can look at it. This is the Alexa mask.,subjective
@idf_video_6961102013279112450.txt, AGO!!!ete!ete!,subjective
@anti_mia__video_7322570444551245102.txt," They just waited until the last minute to show their support. They couldn't have do it this whole time. The court case was announced two weeks ago. They couldn't they couldn't have done it this whole time They couldn't have been the one to submit the court case. No, but now the day before they're signing up better late than never I guess",subjective
@krissy10101988_video_7339551269444455726.txt, continue to follow that breaking news right now what could be a story to step towards peace in the Middle East. We brought you this earlier in the show but now we're getting some new information. The US and Saudi Arabia have agreed on intended a deal for Saudi Arabia to officially recognize Israel. New Newsmax correspondent Daniel Cohen live in Tel Aviv with details. Daniel. Yeah good morning Sean good morning Emma historic enormous huge right all of those words to Apple Pro to describe what we're talking about here let me just have the tables for you basically just catching up okay the US and Saudi Arabia have agreed on the broad contours of a deal for Saudi Arabia to recognize Israel in exchange for concession to the Palestinians also Saudi Arabia wants US security guarantees and I think this is the bigger thing for them help with their civilian nuclear program now that is according to US officials who are quoted off the record and as you said and you set this up the right way a lot of this is not a done deal yet in fact of the white house we're hearing off the record expressing cautious optimism that something can be done in the next nine to twelve months but they have gone from hammering out larger details to some of the finer details listen I read people here in Israel people I respect my that no Middle East foreign policy way more than I'd call it the mother of all Middle East peace deals the Saudi conference Mohammed bin Salman a man in his late thirties the de facto ruler of the King West Saudi Arabia he's been meeting in jettah for the last few weeks in fact months with Jake Sullivan present by national security advisor trying to get these talks moving so now we're hearing their talking specific so the significant concession from Israel would be help promoting the creation of a Palestinian state that's what they're saying I have to tell you I am not hearing that at all here in Israel in return the United States would be pressing Saudi Arabia to impose limits on its foreign relationship with China now Prime Minister Netanyaku I've been checking his Twitter I'm checking anything hasn't said anything publicly yet but since I've been here in Israel and recovering this for you here in Newsmax he has said publicly there is no way that he will give up an inch of sovereign Israeli soil to create a Palestinian state he has said he's willing to make moderate or light concessions what does that mean I don't know but that's antithetical to the ultra orthodox and certainly can ask it right now ministers to be these right who say openly that they don't want,subjective
@eaglelensdrone_video_7308240361472806174.txt," There is only one solution! Intifada revolution! Intifada, intifada! What is intifada? What is intifada? Intifada, intifada! What is intifada? Want to live the intifada! Print the paper! Print the lamp! Now, peace, don't store in length! Pray, print the lamp! Tray, you people! Now, peace, Don't store in length!",subjective
@maniab4e_video_7298129456399420714.txt," They drop the gas to evacuate us, to lead us to go outside Gaza. By the way, this morning, after cutting off the internet, cutting off the connections and cutting everything, they dropped posts from the sky, paper posts, stealing people that they have to evacuate. This is their last chance to go to the south. They have to evacuate to the south, walking, walking without using any vehicle. It's planned. This is genocide. This is the whole elements of genocide. Cutting, making people strive, no food, no water, white phosphorus, and then go.",subjective
@news43312_video_7357658619111902507.txt," Y'all this is game bad. The Iron Dome defense system has failed and this is Israel. They're being attacked by like every single Angle there is his ball of I ran even though who's these are sending missiles at him right now I was pretty sure their Iron Dome was not going to build a compete with everything that was coming all of Israel is red right now All of it and it's just getting started a waves are still being sent as we speak Not just Jordan, but now Egypt has closed its airspace and guess whose planes are flying in right now to assist and aid in help Israel Britain of course it would be right a NATO ally of course the longer this goes on the worst is gonna get because there is so Much headed their way that this is nothing yet and so far 40 Israelis have passed away due to the conflict which just started This is insane The Israeli people were acting fine until they found out that the Iron Dome was not going to protect them from everything that was coming their way This was at the very beginning when the Iron Dome was still trying to keep up with all the stuff now I ran said if Israel does not retaliate it'll be over well guess what the Israeli leaders got together right after that happened and already said they'd be doing a Swift retaliatory strike against Iran This is gonna get a lot worse You might as well bookmark this video because in the history books in the future when you look back at this WW111 what we're going to see is this date right here for the beginning",subjective
@aipac_video_7302176035913731374.txt, SPL,subjective
@juliaguliamaybe_video_7295206222901300487.txt, And the palace line tomorrow will be free The palace line tomorrow will be free,subjective
@dionysistheodorou_video_7296140253511896338.txt," The Palestinian Liberation Organization, the PLO, was created in 1964. What was the Palestinian Liberation Organization fighting to liberate in 1964? In 1964, Gaza was controlled by Egypt. In 1964, the whole of Judean Samaria, the so-called West Bank, was controlled by Jordan. In 1964, East Jerusalem, including the area of the Western Wall and the Temple Mount, was also under Jordanian rule. In 1964, there were no Israeli settlements in Gaza. In 1964, there were no Israeli settlements in Judean Samaria, the West Bank. In 1964, when the Palestinian Liberation Organization was created, there were no Israeli settlements in East Jerusalem. There was no Jewish presence on the Temple Mount. What was the Palestinian Liberation Organization fighting to liberate in 1964? Three Palestine meant then what it means now. Three Palestine means the destruction of Israel, the death of the Jews, and the establishment of an Islamic Arabic state from the Jordan River to the Mediterranean, see three of Jews. The truth is that murderous Arab Islamic terrorists attacks against the Jewish communities began in the late 1920s, even before the establishment of the state of Israel. After the 1967 Six Day War, the Palestinian Liberation Organization launched attacks on Israel from Jordan. In 1970, the safeest country, King Hussein of Jordan expelled the Piallo to Lebanon. The Piallo created conflict within Lebanon, which led to a disastrous civil war. The Piallo launched attacks from Lebanon into Northern Israel, which led to the 1982 First Lebanon War, which practically ruined the country. The Piallo was then driven out of Lebanon by Israel to Tunis. Understand Israel, support those who love life.",subjective
@th3yluvvnoahh_video_7257751869211086122.txt," You gotta be fucking lying. What's wrong dude? My hand now, my hand now.",subjective
@mapsandmore_video_7179982095710752005.txt, السامر لشلع لك عان وجل ينطيك وجف من وهدي لك عمره وشنين بعيش وشوف بدنيانة هي تربحة خسوانة هم من الديانة الديان,subjective
@theechronicles__video_7344020442262392095.txt, 1.5kg 1kg 1kg 1kg 1kg 1kg 1kg 1kg 1kg 1kg 1kg 1kg 1kg 1kg,objective
@meanraneem_video_7321101838952992043.txt," I've been a Israeli guy, my hostel, and he asked where I'm from, and I told him I'm from Syria, and it's like a little awkward for a second, and then he's like, the closest I've ever been to Syria is the go-on heights. Bro, that is Syria. You mother f- Oh!",subjective
