File Name,Content,Subjectivity/Objectivity
@miriamstr0m_video_7292547150100090144.txt," Now, may Schumer, if I may, speaking to you even though you're not present. Let's take one example. So, in June 2008, there was a ceasefire agreement between Israel and Hamas. And by every account, the ceasefire held up for six months until November 4, 2008. Now, you might recall November 4 was election day. And that was the day that Barack Obama became president of the United States. So, all the tension was shifted away from the world and all the spotlight was in our presidential election and its result. What it is we'll do? It did what it always does. It weighed for the right moment and then killed some militants in Gaza. Then, Hamas retaliated. Everybody go back and look at Amnesty International. Everybody agrees the ceasefire broke down on that day and it was Israel who initiated the attack. Why did Israel initiate the attack? Why did it want a breakdown in the ceasefire? Why if there was a ceasefire that Israel wanted the ceasefire to break down? And if you go back and I exhaustively documented it because at that time Israel was not worried about world opinion. The problems with public opinion sitting after Operation Cast Lead with the Goldstone report and I can get to that later. Now, an answer to the question why did Israel attack? The answer was Israel suffered a major defeat in Lebanon. They want to reestablish their deterrence. Yes, they wanted to reestablish what they called the Terrence capacity, which simply is the technical term for the Arab world's fear of Israel. And they were very concerned that after the 2006 Lebanon war, the head of Hezbollah called the Divine Victory, the 34-day war, and the head of Hezbollah, Sad Nasrallah, he mocked Israel and he mocked its fighting capacity. So Israel wanted to restore its deterrence capacity and it shows Gaza as the target. Now, you compare that reality with how any Schumer describes it. They were very honest about what they were doing. They wanted to create a humanitarian crisis in Gaza so as to compel the people of Gaza to overthrow their government. You",subjective
@iltv_israel_video_7218918947687550215.txt, senti nuove olha un' sprechen mio di gue manni conserviamo i quelquesто un piacitorio molto enorme se va il boom,subjective
@sarah_bisans_version_video_7292451224073325854.txt," Hi, this is me, interrupting your weekend doom scroll to ask you to Google something called the Goldstone report Just Google it",subjective
@blackqueerliberation_video_7289100651584605486.txt," This is a history of how the Israeli government funded and propped up Hamas into power and why. The PLO is a leftist political organization. PLO is predominantly made up of people of the Fataan movement, a revolutionary leftist movement that sought for the freedom and liberation of Palestine. The PLO even met with members of the Black Panther Party in 1969. Now you may be wondering how did Hamas, a fringe group, gain political power? Israeli government officials have come out and admitted to funding the Islamic resistance movement to oppose the PLO in the Fataan. Members of the Israeli government have admitted that they created Hamas to desabilize the leftist liberation movement of PLO and Fataan. Kind of like the United States funded the Taliban to oppose communist Afghan forces.",subjective
@celebrityjay4_video_7288174671386643758.txt," I know everybody is like Trying to figure out what's going on between this whole Palestine and Israel thing So I want you to look at this guy here his name is Benjamin Friedman and he gave a speech that explains everything and why we are in the predicament that we are in right now so listen to this video and Trust me it's something that you need to hear On the ground isn't and all of its key Disappearment of the former view and I mean a former view He has bought the communist world conspiracy to send nails and sends today as a meeting American patriot We now take you to the secret platform to present Benjamin Friedman Desire and a coalition Rule this united state as though they were the absolute Now you say The very broad statement to make but let me show what happens while you were I Don't want to wear that out Let me show you what happened while we will all at least I'm assuming myself with you. We will all at least one World War one broke out in the summer of 1914 with the year in which world war one broke out there a few people here Who remember that now that war was wage on one side by great Britain France and Russia and on the other side by Germany all to hungry and What happened within two years Germany has won that war not alone one is Namely the promised actually the German Sufferies which were applied to the world has left all Convoy from the Atlantic Ocean and great Britain just there without ammunition for our soldiers just there with one We Who supply Hark and after that Stargate At that time the French Army had used me they lost 600,000 of the flower of the French youth in the defense the fair judge on the song The Russian army was They were picking up their toys and going home. They just want to play war anymore They just like the dog and the Italian army had Germany not a shot had been fired on a German soil Not an enemy so that crossed the border into Germany and yet He was Germany all bring England They offered England and the school gate to see I'm what the lawyers call a status And say that Let's call the wall and let everything eat the bar before the war Well England in the summer of 1960 was considering that Seriously, they had no trouble They believe it accepting this negotiate the seats that Germany was Dynamically offering them or going on with the war and see totally defeated Why are left with going on Zionist in Germany Representative Zionist in Eastern Europe went to the British war pass and I'm going to be brief because it's no longer boring But I have all the documents to prove any statements that I make if anyone here is curious or Suddenly what I'll possible Designed in London went to the British war cabinet and they said Look here You can just win this war You don't have to give up you don't have to accept an negotiated seat offered to you now by Germany You can win this war because the United States will come into your ally United States was not in the war of that time. We were pressed. We were young. We were rich. We were powerful They told England we will guarantee To bring the United States into the war as your ally to fight with you on your side If you will follow up Palestine after you win the war in other words They made this deal We will just use either space into this war as your ally The fight you must pay up is power Being as you have won the war and defeated Germany off your hungry and church Now England has much right to promise Power seeing to anybody as the United States would have to promise Japan to Ireland For any reason wants to ever It's absolutely Third that great Britain that's never had any connection or any interest or any right in what is known as power Should ever as coin of the well To pay the Zionist for bringing the United States into the war However, they made that promise in October of 16 October 1916 and shortly after that I don't know how many here remember the United States which was almost totally pro-German Totally pro-German because the new papers here were controlled by June The bankers were doomed all the media of their communication in this country were controlled by June and they were pro-German Because There people in a majority of places came from Germany and they wanted to speak Germany which is all The Jews didn't like this all and they didn't want russians to win this war So the German bankers the German Jews who know and the other Banking friends in the United States refuse to find and France or England is the instead of one dog They did decide and they said as all the friends the Germans are tied up with russians not one Seven but they for money the Germany they fought with Germany against russians Find to this there's our strategy now go insane Jews when they saw the opportunity of jettens power time They wasted in and they made this deal as that time everything changed like The traffic light that changes from red to green where the new papers has been all pro-German where they sent Telling the people in difficulty that Germany was having fighting rape Britain commercially and in other Respect all of the sudden the Germans were no good. They were killing. They were hung They were shooting with four traces they're putting off 80s and and they were no good. Well shortly after that This will soon declared war on German the China Able to the United States is just the same night Go to work on president will we're getting from England what we want now you go to work and you go to work on president And get the United States into the war and that is That's how the United States got into the war. We had no more interest in it We had no more right to be in it Then we have to be on the moon tonight instead of in this rule Now the war world war In which the United States participated as absolutely no reason to be our war We went in there we were railroaded into it if I can be bothered we were Supported into that war really so that the Zionist of the world was a tasty halop time",subjective
@ecer.com_official_video_7186866639109999918.txt, e3ai enzyme will trade easier.,subjective
@tuckercarlsonnetwork_video_7333437872898379039.txt," But do you think at this point, as of February 2024, he has the latitude to freedom to speak with you with your government directly about putting an end to this, which clearly isn't helping his country or the world? Can he do that, do you think? Why not? He considers himself head of state. He won the elections. Although we believe in Russia that the coup de temps is the primary source of power for everything that happened after 2014. And in this sense, even today, government is flawed. But he considers himself the president, then he is recognized by the United States, all of Europe, and practically the rest of the world in such a capacity. Why not? Can we negotiate it with Ukraine and Istanbul? We agreed. He was aware of this. He even put his preliminary signature on the document that I am telling you about. But then he publicly stated to the whole world we were ready to sign this document. But Mr. Johnson, then the prime minister of the region came and persuaded us from doing this, saying it was better to fight Russia. And we agreed with this proposal. And the fact that they obeyed the demand or persuasion of Mr. Johnson, the former prime minister of Great Britain, seems ridiculous and very sad to me.",subjective
@yourfavorite_barwench_video_7310517275629686062.txt," This is the view that Nohasein has been looking at for the past 20 years. Behind the wall are the trees she planted and can no longer reach. People in the world wake up agitated from a bad nightmare, but here we are awake and are agitated every single day. The Israeli separation barrier cuts through her family's land in Katanna village, New Jerusalem. I heard the diggers working and saw them uprooting the trees. It was a deep pain in my heart. They didn't care when I lost the trees that I carried on my shoulders and planted one by one. That gets later Israeli forces are back for more. In August they handed several families in Katanna new confiscation orders to expand the wall. They fear that Israel will use the war on Gaza to grab more lands. This is our land and we have the proof. They say you're close to the illegal Israeli settlement, but I was here before the wall. The courts and power are in their hands. My future is over. I fear now for my children and grandchildren's future. Israel started building the wall during the second Palestinian uprising known as the Intifada. Palestinians say Israel used security as an excuse to confiscate more land. The wall's length is more than double that of the 1967 borders, snaking into Palestinian territory, running as deep as 18 kilometers inside the occupied West Bank. The UN says it's almost complete and will take up around 10 percent of Palestinian lands. The international court of justice has ruled the wall is illegal. Roads like this one are all what's left for Palestinians who often have to take longer routes to reach their destinations. For Palestinians the wall is an extension of Israel's system of control. Out of a wider network of roads, settlements and checkpoints built to give Israelis the upper hand while making their lives unbearable by the day. Nida Ebrahim Al-Jazira the occupied West Bank.",subjective
@kompastvnews_video_7347668572329512197.txt," Salah tarawih, Higa Dela Penjang, Dela Kukan Pondo Pesantran Alfa Tah Temborro di Magetan, Jawa Timur. Selama Dela Penjang, Salah Tarawih ini, Juma Hemang Hatam Kan Alkur An 30 Jus. Tarawih Dela Kukan Mulai dari Setelah Isia hingga menjelang waktu sahur. Meskipun Salah Tarawih ini Dela Kukan Pond Pes, Enggak Cuma Santri, Warga Setempat juga ikut dalam Salah Tarawih ini. Setiap tahun jumlah jemahas, selalu bertambah bahkan datang dari luar kota dan luar nagri. Wah, wah, wah! Sudah seminggu puasa, Tarawinya jangan bolong ya! Jika ini, Jika ini,",subjective
@birthrightisrael_video_7130253008520219950.txt," ‫ADMUSY GRIME.共undem Stree. ‫רכא Destrail, ‫שו Communist<|he|> ‫הבחרי דווקא עד הקstoppable ‫מובדים ש그래ו ע coração נהיה.Sm°X encryptants<|ar|><|he|><|ps|>ar, הלידי אול Ferr fertilizer מז HOYT של מ seamless יש לטרב חמכולד הכתנים על א�ósד",not sure
@ladyscraypuzcoc_video_7290379184801680682.txt," I will say frankly I'm one of the people who thinks you should be expelled from this country and I believe that it's to do with policies of your state. If I was Jewish and had never stepped forward in Israel I could claim citizenship there tomorrow, but 6 million people whose origins are in what you now call Israel, who were forced out in 1947 or 1948 to not have that right. Isn't that part of the reason why the Palestinians are in dispute with Israelis? Because you deny them the right to return to their homes and to their land and to their villages. And that they have a legitimate claim even under international law to return but you deny them that right. Why do you deny them that right? And why do you give that right to other people who have no connection whatsoever with the land whether you call it Israel or whether you call it Palestine? Why do you continue to seize land if you're serious about Oslo and the two state solution which under that agreement is land designated to be Palestinian land? 500,000 people most of which has taken place since Oslo you allow that to happen. Why do you allow it to happen if you're serious about giving this land to the Palestinians? It's absolutely extraordinary. Are you not just taking us ambassador for idiots that you can say with a straight face where serious about peace, but while we're serious about peace we're going to seize Palestinian land. And you expect the Palestinians to sit back and do nothing about that. Now you know what the Palestinian people have been asking for. Far less even than some people would ask for because I believe the whole apartheid system should be dismantled. But what they've asked for is to lift the siege of Gaza. Just to lift the siege of Gaza. Let them have an airport. Let them have ports. Let them not be dictated to by a government for whom they do not vote. As to what can go in and out of their territories whether they will have power whether they will have clean water whether they will have medicine. What makes you think you're allowed to have nuclear weapons and the fourth biggest army in the world and this is destruction of the people of Gaza. But they have no rights to defend themselves. They have no territory to protect. Would you ask the best answer? Have you justified those double standards? Very lastly, ambassador. People like Bishop Tutu, Nelson Mandela. And I would certainly describe your state as a apartheid state with different laws for people depending on their race or religion. For example, checkpoints going into the West Bank. There's a channel if you're Israeli or European. And there's a channel if you're Arab. Because you're Arab. If you came into the whole Arab and they stopped you and said are you Jewish? Oh no sir, you can't come in through the same entrance. As Irish people or European people because you're Jewish, you would call that racism and apartheid. You practiced that with your checkpoints and your military barriers and your apartheid wall. How can you justify that?",subjective
@.kayla907__video_7303820480572558634.txt, There is only white solution If people are ever there Shame Long live the people The people The people The people The people The people The people,subjective
@bcpedia007_video_7330082732414111022.txt," In the case of Palestine, we deliberately and rightly declined to accept the principle of self-determination. We do not propose even to go through the form of consulting the wishes of the present inhabitants of the country. The 700,000 Arabs, who now inhabit that age,",subjective
@abrahameducation_video_7310704834766851374.txt," Under the plans section on consolidation of defense systems and fortifications, it lists actions for the Israeli defense force to take as follows. Mounting operations against enemy population centers. These operations can be divided into the following categories. Destruction of villages, i.e. setting fire to, blowing up and planting mines in the debris, especially those population centers which are difficult to control continuously. Mounting search and control operations according to the following guidelines. In circlements of the village and conducting a search inside it, in the events of resistance, the armed force must be destroyed, and the population must be expelled outside the borders of the states. The villages which are emptied in the manner described above must be included in the fixed defensive system, and must be fortified as necessary.",subjective
@travelwithtparr_video_7160164011093495086.txt," 2.1 1.6 18.20.2014, 18.2014, 18.2014, 18.2014, 18.2014, 18.2014, 18.2014, 18.2014, 18.2014, 18.2014, 18.2014, 18.2014, 18.2014, 18.2014, 18.2014, 18.2014, 18.2014, 18.2014, 18.2014, 18.2014, 18.2014, 18.2014, 18.2014, 18.2014, 18.2014, 18.2014, 18.2014, 18.2014, 18.2014, 18.2014, 18.2014, 18.2014, 18.2014, 18.2014, 18.2014, 18.2014, 18.2014, 18.2014, 18.2014, 18.2014, 18.2014, 18.2014, 18.2014, 18.2014, 18 18.2014, 18.2014, 18.2014, 18.2014, 18.2014, 18.2014, 18.2014, 18.2014, 18.2014, 18.2014, 18.2014, 18.2014, 18.2014, 18.2014, 18.2014, 18.2014, 18.2014, 18.2014, 18.2014, 18.2014, 18.2014, 18.2014, 18.2014, 18.2014, 18.2014, 18.2014, 18.2014, 18.2014, 18.2014, 18.2014, 18.2014, 18.2014, 18.2014, 18.2014, 18.2014, 18.2014, 18.2014, 18.2014, 18.2014, 18.2014, 18.2014, 18.2014, 18.2014, 18.2014, 18 14.2014, 18.2014, 18.2014, 18.2014, 18.2014, 18.2014, 18.2014, 18.2014, 18.2014, 18.2014, 18.2014, 18.2014, 18.2014, 18.2014, 18.2014, 18.2014, 18.2014, 18.2014, 18.2014, 18.2014, 18.2014, 18.2014, 18.2014, 18.2014, 18.2014, 18.2014, 18.2014, 18.2014, 18.2014, 18.2014, 18.2014, 18.2014, 18.2014, 18.2014, 18.2014, 18.2014, 18.2014, 18.2014, 18.2014, 18.2014, 18.2014, 18.2014, 18.2014, 18.2014, 18 18.2014, 18.2014, 18.2014,",objective
@notyagurl_video_7292418272748686634.txt," Google, the Goldstone report, you should come up with something from the United Nations. This is one of the press releases related to all that was, you know, detailed in the report. So I highly recommend taking a read. You'll notice the date it's 2009. And it's very enlightening for anyone who is, isn't sure what to believe, right? Do I believe like Israel? Like Israel's news? Do I believe our Western media news? A lot of human rights reports were in by the Nations. It's how we find out about a lot of the fucking atrocious human rights violations and war crimes committed in many countries that we just don't have access to, unfortunately, or are living there ourselves to really witness it.",subjective
@yasminandapo_video_7290198415810530593.txt," Ooooh Hayırshot him Boğur Tーce Ya mi, aklına tıklan Uf Bами mustал o yüzden teşekkürler. Ne? Yok. Tamam, teşekkürler. Hoş geldiniz. Bu videoda da bir şey. Bu videoda da bir şey. Bu videoda da bir şey. Bu videoda da bir şey. Ne? Turkey. Türkiye. Türkiye. Türkiye. German. Türkiye.",subjective
@tiktokworld5862_video_7356064271819918638.txt, I'm going to put it on the top right corner. I'm going to put it on the top right corner. I'm going to put it on the top right corner. I'm going to put it on the top right corner. I'm going to put it on the top right corner. I'm going to put it on the top right corner. I'm going to put it on the top right corner. I'm going to put it on the top right corner. I'm going to put it on the top right corner. I'm going to put it on the top right corner. I'm going to put it on the top right corner. I'm going to put it on the top right corner. I'm going to put it on the top right corner. I'm going to put it on the top right corner. I'm going to put it on the top right corner. I'm going to put it on the top right corner.,subjective
@joeshmo334_video_7204887838607904046.txt," Finally, Palestinian citizens of Israel, they have been through it all. They are the group that remained in Israel despite the ethnic cleansing in 1948. They lived under Israeli military rule that applied only to them and not Jewish Israelis for 18 years between 1948 and 1966. They were made citizens but can never become nationals and enjoy equality unless they become Jewish which the law prohibits. They are the only Palestinians who can run and vote in Israeli elections and they can move relatively freely but the inequality against them was never dismantled and they face daily institutional discrimination including as members of parliament. And if this complex ID system wasn't enough to segregate the Palestinian community, in 2002 Israel introduced the law that prohibits family unification. That's right denying Palestinians the right to live with their loved ones if their ID cards are different. And this woman is one of thousands of Palestinians who Israel will not issue any ID card. She can't travel, can't hug her family, only see them meet us away across the border. Putting down roots, the family home, these are crucial parts of what make strong community. To make sure Palestinian communities can't develop any further Israel has made it almost impossible to grant building permits for Palestinian homes. So, Palestinians live in a catch 22 situation. In order to have shelter, to develop their communities they must build without a permit. And if they do so, Israel can demolish the structures on the basis that it was built without a permit. Right now there are over 150,000 Palestinians currently living under the constant threat of demolition and forced eviction. Many of them for the second or third time. In the West Bank an average of 18 Palestinian structures were demolished every week in 2020. The same year Israel issued 1,094 building permits for Jewish applicants and only one for Palestinian. This goes back to the heart of the issue. To maintain the state's character as Jewish, Israel systematically disadvantages Palestinians while privileging Jewish Israelis. This racist privilege has been enshrined in laws, policies and practices and it enables Palestinian resources to be taken in order to economically benefit Jewish Israeli citizens. The system of apartheid is the Israeli state's oppression and domination of Palestinians on a daily basis. It's the laws, the policies and the practices that it puts in place and then implements to control Palestinians daily lives. And then the crimes of apartheid, the crimes of apartheid are those acts, those violations, those patterns of violations that Israel is committing to create and then maintain that system of apartheid. Amnesty International and other rights organizations have been documenting patterns of human rights violations and international crimes for decades. These are the most visible and violent part of this system. At the end of May 2020, 4,236 Palestinians were held in Israeli prisons. 352, including two children, were held without charge or trial. Between September 2000 and February 2017, Israeli forces killed 4,868 Palestinians in the occupied Palestinian territories, including 1,793 children outside the context of armed conflict. An Amnesty International is not aware of any case in which an Israeli soldier has been convicted of a willfully causing the death of a Palestinian in the occupied territories since 1987. This imbalance of rights, justice and accountability is never more clear than when a Jewish Israeli life appears to have more value than a Palestinian. Israel is a partite and its cruel and prolonged strategies that liberally disadvantaged Palestinians wherever they live. They cannot claim and enjoy equality. Jewish Israelis. Look, everyone can make a difference. Together we need to speak out on behalf of Palestinians. We need to speak about the human rights violations that they are suffering. We need to talk about the apartheid, the system of apartheid to which they are subjected. Because by campaigning together, putting pressure on the Israeli state, we can have this system of apartheid dismantled. Join us, join our campaign. Everyone has the power to make a difference.",subjective
