File Name,Content,Subjectivity/Objectivity
@noshamefoodpantryvisits_video_7101875126127398190.txt," I get asked a lot, how many food pantries do you go to? Or how often do you go? My answer is always the same. I go as often as I need to feed and support my family. Food prices are crazy. Gas prices are crazy. Everything is going up. If I'm able to visit food pantries to save on costs so that then I can pay my other living expenses such as gas, electric, or medical bills, I'm going to do it. It's a great option. And as more and more people are struggling, it's something that should be discussed. This food pantry has a working relationship with the local grocery store. Every week, they go and pick up any items that are damaged, just pass their best-by date or are getting ready to expire. Every Saturday, they open their doors and anybody in the community can come get a box of food. There's absolutely no income requirement. And the only stipulation is that you live within the community. They always have a wonderful selection of items that include breads and pastries and desserts. They usually have some meats and some milk and canned items. There's always a lot of shelf-stable items to choose from. I don't go every week, but I was able to get there this past Saturday. And I was able to get a box of food. Here's what we got. Donuts, pastry, cake, lots and lots of crispy cream donuts, another pastry, some sodas, celery, asparagus sauce, cranberries, hamburger, chicken, hot dogs, pizza, and milk, strawberries, and some snacks. This box will last my family a couple weeks and allows us to save money to pay other living expenses, as well as save things for being tossed out. I can follow for more pantry visits.",subjective
@ronniethecpa_video_7200468458042182954.txt," All right, so the IRS recently came out with guidance regarding state tax payments issued in 2022 That was in relation to things like disaster relief. So if you recall there was some uncertainty on whether to include these state payments on your federal income tax return which will mean that you will have to pay taxes on this money So the IRS is finally saying that you do not have to include these state tax payments on your federal income tax return Therefore having to pay taxes on it which makes a lot of sense because if you're going to provide me relief on the lens of a Disaster then don't turn around and try to tax me on that same money, right? All right, so make sure that your tax pro is not including your state tax payments in your federal income tax return All right, y'all have a good day",subjective
@no.otherr__video_7358818141943647530.txt," You'll better stop playing and get you only WFH job. I'm going to stop playing and get you out of work from home job. They are giving them away. Stop playing. Run. Anyway, if that being said, I have four jobs that are hiring immediately. Okay, some of them you don't even need experience at all to apply. Okay, so when I say run, you need to run. The very first one is five star call center. Okay, they want you to have no experience. They will train you. Okay, run. All right, the next one is broad path. They want you to have medical and claims experience. This one is a weekly pay. So some of y'all are like, hey, I'm not going to wait until two weeks to get paid. This one is for you, right? The next one is centine that's C-E-N-T-E-N-E. They're hiring for a customer service advocate. The pay for that one is 15 to 22 an hour. So make sure you are negotiating. Okay, because there's no reason why you should begin 22 hours instead of that 15, right? All right, this is Monday through Friday. So absolutely no weekends. And they're looking to fill the shift of 10, 30 to 7 p.m. So some of y'all are like, I don't know, work at 7 to 8 in the morning. This one is 10, 30 to 7 p.m. Okay, and the last one is safe light. Okay, they're hiring for a customer service representative. And equipment is provided. Okay, so y'all need to run. Not going to tell y'all again. Y'all going to hit me in black. Oh my god. Let me get you to work for a home job.",subjective
@victoria.therese_video_7299191293509422341.txt," I may be a psychic, but I did have a master's in political science of the concentration in public policy, so I just want to have a very serious conversation about how policy analysis rewired my brain to approach public discourse and just politics very differently. I feel like the way that I approach it is a lot more effective, and I understand how government works so much that I know my place and what are the important things to discuss and how to consider issues as we move forward. I think in the cusp of a potential revolution, I very much hope that people have a greater understanding of how policy works so that you can also make more efficient decisions and create better, better lasting change in the world. So let's get into the basics. What is public policy? I just like to define the thing that I start up with, but it's basically a practice and discipline of making tangible written rules that govern a group of people or society at large. It can also be a set of actions, plans, laws, behaviors adopted by a government, can also consider courses of actions and funding priorities, so a lot of these different things that are all involved. One of the things that really changed my life was realizing that in public policy, no decision is a decision, so that means that if a problem is brought into government and your government decides not to do anything about it, that is a government decision, okay? That may mean that they don't want to take accountability and they don't want to upset certain stakeholders or it may be too expensive or they may want it to simply uphold the current legislation that is affecting these things. There's also two really big consequences of policy or legislation being introduced from government who have the output and the outcome. Now why are these two so important is because the output is the direct effect of that legislation. So for example, you made something legal or illegal, but the outcome is also a consequence. What is the outcome? The outcome is the societal changes that are direct effects of that policy. So consider the fact that policy actually creates ripple effects. So in a very specific example, making abortion illegal makes abortion illegal, but it also creates high maternal mortality rates, higher likelihood of women having miscarriages being put in jail and being punished. And as we see in America, a lot of doctors leaving and moving to different states and actually collapsing maternal maternity care centers in the United States. I'm laughing because it's really, really scary. All of these things are consequences of policy. You also have to understand that something is very important is usually not one single thing that causes one other thing. Like there's not just like a single singular cause and effect. There's usually a lot of different factors that result in specific problems that governments need to address. Governments will also do this thing called cost benefit analysis. I didn't learn this in my policy program. I learned this like when I was reading a book, the happiness industry, William Davies. Jeremy Bentham is considered the father of public policy and Jeremy Bentham developed the happiness principle, like largest amount of happiness for the greatest amount of people. So a lot of the times, governments do kind of seek to adhere to that principle, but more often than not, we actually look at it regarding stakeholders. So stakeholders are essentially people that are for against and persuadable in this policy being introduced. Which means that it's not just civilians that we are affecting. It's also like, for example, corporations who feel like their different industries are being threatened and they may lose money. You can look like certain political figures who feel like they may like lose something in the stock market or they will lose donations from, you know, certain very wealthy stakeholders. So like wealthy people and people in power are typically considered stronger stakeholders. It doesn't mean that civilians and civilians that organize and also join interest groups or nonprofits or international organizations. They also matter a lot. And then you also have this thing called the cost benefit analysis. They will literally come up with a bunch of different solutions and they will also do the math to identify how expensive something is. All of these different things contribute to policy. Now, the thing that I find really annoying as somebody who is like super in favor of universal basic income is that poverty is like a lot more expensive than we just gave people like free money. And in Canada, corporate welfare is also one of the biggest parts of our Canadian budget. And they still don't have to pay taxes. That annoys me. Anyway, so those are just some of my random scattered thoughts regarding policy. If you have any specific questions, I hope I can answer them. If not, yeah.",subjective
@us.hood_video_7345396613705190699.txt," The poorest project housing in the United States. Top 5. Parkway Gardens in Chicago. Parkway Gardens is a dangerous and extremely poor project housing area. The area is known for its insecurity due to gangs, but also for its poverty. The families living there are poor, with low incomes. It is this poverty that fuels youth gangs in the area. Top 4. West Park in Philadelphia. Poverty is pervasive in this project housing neighborhood. Residents live on low wages. Buildings are poorly maintained and often squatted in. Top 3. Brownsville in New York. The residents don't live. They survive. Indeed, most residents are poor, and many are foreigners. Top 2. Hilltop Village in Jacksonville. The project housing is so poor that some buildings are abandoned. Top 1. Ramona Gardens in Los Angeles. The project housing is inhabited by African Americans. It is extremely poor.",subjective
@_patrickkim_video_7151408320736283947.txt," California will start handing out $1,050 stimulus payments to residents this week to combat inflation. This is somewhat true. Back in June, Governor Gavin Newsom decided to provide a middle-class tax refund to help people with inflation. As long as you're part of the middle class and filed your 2020 tax return and live in California, you can receive payments of $350 to $1,050. This shows the amount you'll receive if you qualify.",subjective
@chaotic_hungry_video_7313543662082854174.txt," So the comments of that video have shown me that a lot of people don't understand the difference between a food bank and a food pantry Because they are very very different food pantries is a general term food closet food Whatever and these are the actual agencies in the communities where people go to pick up distributions of food This may be a church may be at a you know any kind of agency that runs these things the general collective term for this is food pantries And these are almost always an individual's access point to these services a food bank However is much different a food bank is generally a large organization that serves an entire region and is usually a warehouse situation where Millions of pounds of food are stored they run like distribution centers similar to like a Cisco or a Gordon's food service They source their food from very different places usually they get a whole soda nations and or wholesale purchase orders But they also get like the big boxes you see at grocery stores and that all gets inventory and stored on shelves or in coolers Food banks are also usually the ones who run Regions USDA commodities programs, so they store the food from the US government as well. There's usually one food bank for a big region For instance here in Tennessee there are five food banks across the country across the state and each of them serves about a fifth of the state and Almost always they're a part of an affiliate group with feeding America or some other agency like that that works nationwide and they might also have Regional associations that they talk to each other with so a food bank is the large macro Agency and the food pantries are the smaller agencies where people actually get service And the way this usually works is that a food bank will have partner agencies that are food pantries and food pantries can buy food from the food bank to Distribute usually it's pennies on the pounds so you'll say I want you know 10 cases of green beans and it will be like three to ten cents a pound and Most of the time almost all of that is just covering administrative costs and then because USDA commodities are usually free They will sometimes add on you know a little bit of costs for delivery I think it's like that most of the time it's free if you order something else and in my experience working in the food pantry It was it was usually like a lot of like you know every Tuesday or whatever You would have the chance to bid on food items that you know the other 300 agencies were also bidding on Which can make a tricky because even if we had usually around 700 customers a month and so If I'm gonna get something I want to make sure I've got at least 700 of them or an aggregate of 300 of this and 400 of that and in our case It was one of those things where the earlier we got our orders in from the sheet the more likely We were to get what we asked for now all that being said food banks Don't usually do direct service to clients, but there there's a lot of exceptions I've seen it to where food banks won't do regular distributions, but they'll do emergency services Most of them if you reach out to them they'll They'll tell you where your closest affiliate partner paint pantry is But if you just show up to a food bank looking for food, they're almost never gonna turn you away But that's just not their role in the system their role in the system is to be the aggregator and distributor to other smaller pantries That being said a lot of food makes now we're doing what are called mobile pantries Well, they will load up trucks full of food taking to specific locations that are predestined and pre-scheduled and do Distributions to people in their cars, but that takes a lot of effort and a lot of planning a lot of volunteer labor So to this comments point yes if you were donating directly to a pantry Money is still always better because money allows those pantries to have a better chance at getting what they need from the food bank Or going and buying themselves But if you know that a local pantry near you has a very specific need please go buy that Like if you're telling everybody we really need green beans go buy a case of green beans if they're asking for it But even in a case like this it still stands that they're more likely to be able to get the same products cheaper From the food bank or from the own from the grocery store that you're going to go to with your taxes and status So unless they're specifically asking you to buy things specific things for them It's still a better option to give them money because then they can also pay their staff with it Another really important thing to mention about this is that food banks can engage in a lot more Things like advocacy than food Patriots can often a food bank will have an advocacy arm that Advocates around things like snap and WIC and other food access programs They're also likely to have people on staff who do things like sign people up for snap this snap program Many of them have like a government relations arm where they have lobbyists on staff who do things like make sure that legislation that's being introduced in their region is not harmful to people who are in need of food They will also have staff whose job is to engage with partner agencies around the state Who do things like that and build those interagency connections to make sure that the food system as a whole Is stronger so food banks do a lot more than just provide food and actually as we're seeing right here in Davidson County Tennessee there are A lot of things they can do in the case of like something like a tornado for instance They are prepared to activate in situations of disaster and emergency and oftentimes what that means is just connecting with the Painteries in those areas where the emergency happened and making sure that they are set up for success for the people that are inevitably going to come Yeah, hope that helps",subjective
@adriannacrawf0rd_video_7356972551597313285.txt," If you are looking to work from home, here are three positions hiring today. We'll have the links to all of these jobs on my remote job board linked to my bio. CSAU is hiring a remote support content specialist. This is a contract position paying $17 an hour. Boldly is looking for a part-time executive assistance is paying $24 to $30 an hour. True car is hiring a remote consumer support specialist. This is remotely US, and it's paying $18 to $20 an hour. The links for all of these jobs will be on my remote job board linked to my bio.",subjective
@max.ae_video_7246045261066243335.txt, الآن Let's do something about the Unemployment Shower Scби ومن then Liber نحب probably Stu and respond to the start of faire سنجій Wiz يتindفين في المتanchة ن crusοل الق trainers و كنت أخ Makeshrooms,subjective
@cptsdtherapist_video_7137419800522935598.txt, New episode,subjective
@absorbclips_video_7266611155924274438.txt," I'm trying very hard to stay in the pudding. Yeah, yeah, I'm sorry. If you need to take a moment, totally cool. I'm just... I'm just watching, sorry. Yeah, no worries. Take your time. We got plenty of time, like I was saying. It's hard. I know it's hard, but you're so strong, because you flew all the way out here and... Mm-hmm. And it's okay to feel these things, because... Yeah, like I said, you're here to talk about it. Do you want to take a quick moment? Sorry, what? Do you want to take a quick moment off stage? No, I'm here now. Okay. Hi. Hi. Hello, Kyle. Nice to meet you. Nice to meet you. What's up, Runa? Yeah. You're not cool with the skirt? No, not really. No. I see you trying to cover it up. Yeah, no, it's all looking in my legs. So you don't approve of names choice. I mean, I prefer not to be in it. Yeah. Like, I mean, cool. It looks great on home, whatever. Yeah. You should be a little cute as hell, but... Yeah, yeah. Oh. Oh, I wouldn't personally prefer it. You wouldn't personally choose it. Yeah, exactly. Do you mind continuing this interview? No, no, I'm good. I know where we're here. Do you proudly tell people that you have DAD or is that something that you keep more of a secret? Depends on the person. Yeah. Like, if it's a professional situation or something where if somebody does have like a stigma around it or is very... I don't know, like, not open to it or a little bit oppressive around it. That could be like seriously damaging to whatever we're trying to do. Yeah. Sometimes it's just safer to like not say anything. What's the most annoying question you get about DAD? Honestly, the one that bothers me most is who's the real one? Yeah. Because that really is like... We're all real, though. Yeah. Like, oh, well, psychologists don't believe the idea exists. Yeah, they do. It's been like in a DSM and the ICD. Yeah. It's in there. Like, it's recognised, well-wires, it's a treatable disorder with, you know, known cause and there's a ton of medical evidence behind it. Like, people have been in CAT scans and brain scans and stuff and switch while they're in there and you can literally see different parts of the brain lighting up.",subjective
@onlyjayus_video_7333720625522937119.txt," I hate to be the bearer of bad news. Actually, no, I kind of enjoy it. Can access somebody's internet search history through the Wi-Fi? This is absolutely 100% a thing and clearing your search history or going incognito mode will not save you. When I was in college, I taught a computer science class to fourth grade girls in the whole Wi-Fi security conversation kind of went like this. Okay, you are trying to send a letter. Go to website. That letter has to go to the post office, also known as your router before getting to its destination, the website you're trying to get to. Anybody that works at the post office or has access to that Wi-Fi network can read your letter. There are a few different apps and websites that can do this for somebody automatically. But doing it manually is like, it's so scary simple. While somebody has to do the little peek at what you're searching on that phone, computer, Xbox, anything. Anything with the Wi-Fi connection is just copy the router's IP address, paste that into Google to be a devices page, diagnostics, and then a log sheet that'll give you just a list of every website ever visited.",subjective
@kenoshayououghtaknow_video_7311191533955386667.txt," Hey, Kenosha. You ought to know that this coming Tuesday, December 12th is an important school board meeting. The school board meeting will be held at Indian Trails High School. And the reason for that is they're expecting a lot of people. It will be at this school board meeting that the district will decide or the school board will decide whether to accept the district's recommendation for right sizing. Right sizing is a fancy way of saying school closures. KUSD is looking to close a bunch of schools. They're doing it because they say of declining birth rate is causing a lot of schools to be under capacity and that this is not financially efficient and that they are facing a budget crisis. So they are proposing to close a lot of schools and change the school boundaries. So even if your child's school is not on the list of when the school is to be closed, it's possible that your kid could go to a different school because of the changes made to the boundaries. So let me really quickly go through which schools they are saying they're recommending to the board to close. For the elementary school it's Epsola, Jefferson, McKenley, Stacker, and Vernon. This is going to affect about 20% of the students are going to be displaced and have to change schools. For the middle school, they're talking about recommending closing Lincoln school. But on top of that, they are talking about closing Washington school and taking all the students as a whole from Washington and putting them at Epsola. That's going to impact about 15% of the students. For the high school, they're talking about closing Ruthir. They had a school board meeting, a special one a couple weeks ago at Ruthir where a lot of people gave very passionate speeches about why Ruthir should stay open. They had students, former students, current students, faculty members, all people saying that Ruthir and the program at Ruthir is really like changed the trajectory of their lives and is a very important school. So if you have kids in the district or are just a community member that cares about KUSD and what's happening, you should come to the school board meeting on Tuesday, December 12th at 7pm at Indian trails because you ought to know what's going on. All right, talk to you soon. Bye.",subjective
@britfoley_video_7207150968281042219.txt," Alright, so health insurance was definitely one of my biggest worries when I was considering taking time off from my job and I think this can be one of the main barriers for people who if they want to quit their jobs or maybe work a part-time job where there aren't benefits but there are a few options. So at my old job I had full health insurance benefits and then included dental and vision and I would pay like a subsidized premium each month. I think I paid probably like $55 and that would give me all my health insurance benefits and things like that. And then when I quit there's something called Cobra where you have the option to extend your current health insurance dental and vision plan for up to 18 months after you leave your job. You just are responsible for the whole premium. So that option I think altogether is like $340 a month which is obviously more expensive but it's a good option if you're maybe only going to be unemployed for a few months or you're between jobs and then in Massachusetts there's also Mass Health which is like a public insurance company and this is for people who qualify based on their income level or disabilities and it's basically a tiered system where you pay copays and premiums depending on how much your income is. And that's a victim as health but I do know that with like Obamacare I think there is a national health insurance system where there are different public insurance plans at different state by state. You could also just go to a private insurance company and rule and pay the whole premium yourself there. I assume that would be the most expensive option but I'm not entirely sure but yeah so few different options there I would definitely recommend looking into it before you quit your job and just see what works best for you especially if you have specific health needs or things like that.",subjective
