File Name,Content,Subjectivity/Objectivity
@emilyanntowner_video_7063195223559638277.txt," Can you guess the deadliest mental health disorder? I'm a PhD student at Cambridge studying psychology and the brain. If youth of a deadliest mental health disorder was depression, schizophrenia, or bipolar disorder, guess again. It's actually eating disorders. Eating disorders such as anorexia nervosa, bulimia nervosa have the highest mortality rate among all mental disorders. This is especially concerning as these disorders are most common among adolescent girls and young women. The mortality for this disorder has gone down in recent years, possibly due to improvements in diagnosis and treatment. Prevalence among young women in 15 to 19 has actually gone up. Further, a recent study showed an increase in the incidence of eating disorders since the onset of COVID-19. If you or someone you know is struggling with an eating disorder, please reach out for help. Treatments are available and you do not have to go through this alone. For psychology and neuroscience content, like this video and follow for more.",subjective
@watchfulcoyote_video_7229422895800372522.txt," I understand that most people are perfect all their lives, and this video is not for them. So if you're perfect, feel free to keep scrolling. Okay, now that it's just those of us emotionally mature enough to recognize that literally everyone causes harm, let's talk about it. I'm really glad that some of you all have resonated with my videos, and I need you to know that what I share doesn't just come from books, it comes from hard earned, expensive wisdom. So if you've ever hurt someone, I think this video is worth the nine minutes. When we recognize that we've caused harm, we often feel shame. The name is a big word in English, it tries to encapsulate two opposite meanings. The first meaning is self-hatred. This is a growth prohibiting stagnating emotion. It's selfish and harmful and allows us to continue causing harm because we're identifying with being harmful. I cause harm so I am a harmful person. The second meaning of the word shame is learning. As in, oh, I'm ashamed of myself for not realizing that my mother-in-law was doing dishes while I sat on the couch like an elf, so I'm going to pay more attention and get up next time. In the second case, I'm not identifying with the behavior I'm ashamed of. I'm learning from its effects. It's easy to see that with a small example. It gets much trickier when the harm you've caused is more serious. And here's the thing, guys. In 15 years of menswear and men's groups, I've never yet met a man who has not caused serious harm to women in his life. As in, on the spectrum of sexual assault, domestic abuse, serious harm. Our expressions of these patterns vary greatly and that matters, but we all carry these patterns and we've all acted on them. The difference is that some men have had the support and or courage to face our inherited patterns of dehumanizing women. And most men think that, ah, that girl screamed at me or ran out crying that one time because she was crazy. Spoiler alert, bro, it wasn't her. You can spot these guys in my comments because they're the ones who feel the need to go type, I've never heard a woman or you're the problem. That pressure that drives men to say that is the fear of facing the possibility that they have. This is what modern male cowardice looks like. If you were actually the only man in the history of Western civilization who's never harmed a woman in any way, you wouldn't feel the need to say it because you'd be able to see how the trend I'm speaking to is accurate regardless of your exceptionality. Every single man in our culture was taught to dehumanize women until you face that potential in your own history in life, you're unsafe to everyone close to you. The shame that comes up for men when we face the fact that we've caused serious harm is literally lethal. I know. It drove a decade of suicidal addiction for me when I faced the fact that I had unknowingly done seriously harmful things. This isn't hyperbole. I spent years thinking the world would be better off if I were dead, like fucked up on drugs with the barrel of my gun in my mouth. I know what that self hatred for having caused harm feels like. I had the mixed blessing of some degree of community support in my awareness. I had close male friends who lovingly helped me see some of the impacts I was having on my partners. I had X's who told me how I'd hurt them, not everyone is so lucky. Because I live in the same tiny rural community I grew up in, and because I've led a very public-facing life even before TikTok, there are a lot of people around me who know my patterns of harm from 15 or 20 years ago. There's a lot of people who've never met me, but heard about my patterns and hate me for it. If you're a man, there are almost certainly people who hate you too, whether you know it or not. And this is what I want to talk about. Knowing that you've hurt people and knowing that there are people who hate you for it asks a great, great deal of you as a human being. It asks us to evaluate what our values are, what we were taught that led us to behave in ways that violated those values, how that led us to detach or dissociate from our essential unwound itself, and how can we build healthier identities that lead us into closer integrity with our values? It's work of deconstructing our inherited self and constructing or recovering who we want to be. I believe that the reason Shane leads us to feel suicidal is because there are parts of us that we can feel are out of integrity, parts of us that need to die, and we can let those parts of ourselves die and become healthier without them. Everyone in our lives is impacted by sexual assault and domestic abuse, and those things rightfully bring up very strong emotions. They've also been in the dark for far too long, and me too movement has been necessary medicine, been a long time coming, and all this pent up emotion about this makes us men feel even more terrified of having caused harm anywhere on that spectrum, and feel even more shame when we face the fact that we have. It also brings us to the other edge of the double edged sort of community support. Some of the same people who supported me in seeing my patterns of harm against women in my life 15 years ago have never been able to see my growth since then. Their identity in our friendship became about the harm that I'd caused. This is well intentioned, right? They're trying to enact community support, but that didn't make it any less harmful for me. As I grew, their relationships with me weren't just informed by the knowledge as I'm in my past, but were entirely defined by it. Their identities as allies in this way became restrictive for me. I'm a decade clean and sober, happily married to the only woman I've been with in many years. I've publicly acknowledged the ways I've been harmful, apologized, repeatedly offered community process, anyone who felt harmed by me. Some people took me up on those processes, some didn't, which is obviously fine, but none of that matters to some people who know my patterns in 15 or 20 years ago. Their identities are now built on me being a perpetrator, a monster threat. These are well intentioned people, some of whom would say they love me very much, and some of whom would say they fucking hate me, but for all of them, my growth threatens their sense of self. I deeply understand this because I was this way. I started trying to do accountability work with men in my community long before I was aware of my own harmful patterns, and I dehumanized and isolated those men. I harmed them and drove them away from support and relationship with me. My identity as an ally or as someone on the right team locked them into an image for me that I couldn't let them grow past, so they stopped engaging with me. In the same way, I've had to cut people I considered friends out of my life because their identities were built on an image of me that was no longer realistic if it ever was, and I wish I'd been able to see clearly enough to do it sooner. I know that my circumstances are a little extreme, but I believe this pertains to everyone who's caused harm, and here's my suggestion. Don't try and stay in relationship with anyone whose image of you locks you into patterns that you've actually healed from. All that will do is slow you down and make self love and continue to healing harder for you. This is true for people who hate you and true for people who love you. If you've caused harm in ways that are known, it's very, very likely that you've also been harmed by well-intentioned people trying to make the world a safer place. We are all raised in a culture that teaches us that the appropriate response to harm is more harm. It's called punishment for consequences, but it's just a perpetration of the cycles of harm that it's trying to heal. In order to grow, you will need to not only face the harms that you've caused, but also forgive the people who well-intentionally tried to help their community and harmed you in their efforts. This is incredibly hard work. The irony and self-defeating nature of it can tear you apart and make you better. Again, ask me how I know as a man who's out as having caused harm and working on it, people in my community often come to me about other people causing harm. And some of those people causing harm passionately hate me for the harm I caused and are quite public about that. The irony of knowing the patterns of violent harm being perpetrated by people who hate you for your old patterns of harm is a bitter pill to regularly swallow. It's made me reflect a lot on how I tried to practice accountability before I knew my own patterns. But forgiving those people continuously, as they're harming me, my family and my community with their righteous hatred, has been some of the most intensely liberating work I've ever done, far more liberating, grounding, peaceful, relaxing than the heavy work of facing the harm that I caused. So that forgiveness is not for their sake. It's for mind. It sets me up to create and live in the world that I want to live in. If you want to heal the cycles that led you to cause harm, you have to heal it all the way through just being less harmful, but remaining bitter and angry about it doesn't actually help. It's a way to cause harm in other ways. Some people I harmed have forgiven me and I hope that some day those who haven't forgiven me can as well. Not for my sake for theirs, so they can also grow and heal and together we can make a safer community and stop the cycle of just passing trauma back and forth. Despite that hope, know that there will be people for whom it will never matter what you do. Your healing is irrelevant to them because of the harm you caused, whether real or exaggerated, it's now foundational to their sense of themselves as an ally or a safe person or one of the good men or a feminist or whatever. Learn to spot that early on. Courageously take their feedback, let it inform your awareness of your own patterns of harm and if they can't grow with you, let them go. Whoever they are, sure make a good faith effort to help them grow the same way they did with you, but if they can't see it, if all they can hear in your efforts to help them grow is the idea that you need more validation for your growth or something else that isn't the point that all let them go. It would take an incredible, herculean, the amount of work for those people to see you now because it would require a shift in how they think of themselves. Not only that, if they're part of a community whose identity is contingent on you being harmful, then for any one of them to acknowledge your growth would risk them being demonized and ostracized as not an ally, they no longer be in the in-group of the good guys. You can't do that work for them individually or collectively, all you can do is heal yourself. If your sense of healing or growth remains hung up on what a single person or group of people think of you, you're limiting your own growth. My therapist explained to me how if we have codependent history, we can actually heal in our current relationships, but remain in functionally codependent relationships with people from our past, especially people who hurt us or who we hurt. Don't let those outdated codependent needs for validation define your growth. You are free to heal and grow regardless of what anyone else thinks of you. If you want to think about protecting your family, consider this. If you remain in community with people whose identities are based on an outdated harmful idea of you, then anyone you date, your children or your future children, can only exist in those communities in the shadow of the past that you've worked so hard to heal from. Again, I'm not saying to cut off anyone who knows your harmful history, the people I'm closest to in my life know my history the best. I'm saying that if someone's concept of you cannot keep up with who you've worked so hard to become, then consider carefully how much access to your family and you they get, because their projections of your past for the maintenance of their identity are going to cause harm, so it might be a chance to practice a hard boundary. This is the next layer of community growth that we must face if we want to heal the cycles of harm. If your efforts at community growth or accountability or safety are chaining, your friends or community members to the worst expressions of their historical wounds long after they've healed those patterns, then you are planning an active role in perpetuating cycles of harm by rebranding those harmful cycles as support or healing. We all instinctively want to distance ourselves from those cycles, and the primary way that expresses is in pretending that this is an individual problem. If we catch this one man, we've done it. This mindset makes it harder to see that it's not one man, it's all men, including you or the man sitting next to you. When we accept the public dehumanization of people branded as harmful, we become complicit in the ongoing colonial violence of dehumanization, excusing harm, which perpetuates the cycle. We're a collective species. Ostracization feels like death because it literally is. We're all carrying harmful patterns every one of us, and fear has never stopped a single crime, which is why the entire US penal system is statistically just a factory from making more criminals, and until we liberate our efforts at both community and individual healing from the carceral punitive mindsets we all inherit, we're not actually healing the cycles at all. Me too is necessary to drag these issues into the daylight, but it's not the end. Now we need to do the hard, dirty, painful work of figuring out how to actually support everyone's growth and the healing of masculinity.",subjective
@healwithbritt_video_7024294971024887046.txt," Here are seven signs that you may be experiencing chronic loneliness. First, what is chronic loneliness? Well, chronic loneliness can be described as the constant separation from others and the world, or the inability to connect with people in a deeper way. In a time when we are literally more connected than ever, via social media and technology and the like, we are actually lonelier and more isolated than we've ever been. According to the CDC, we are in a loneliness epidemic and this started even before the pandemic. Rates of loneliness in the United States have doubled in the past 50 years. Over 50% of Americans feel isolated or alone. Gen Z has been deemed by the CDC as the loneliest generation ever in the history of our country, and over 68% of Gen Z feels like no one knows the real them. So here are some quick signs that you may be experiencing chronic loneliness. Number one, oversharing or over explaining when there's finally someone there to listen. Number two, putting other people's needs or wants before your own. Number three, avoiding conflict, confrontation, or sharing how you really feel. Number four, feeling like you don't truly belong or the odd man out. Number five, not being able to express your boundaries to others. Number six, becoming obsessive or codependent with your friendships. And number seven, being a constant helper, fixer, or people pleaser. Are you experiencing chronic loneliness? Check out part two on how you can combat it.",subjective
@consumerawareness_video_7157901046696643886.txt," So I'm not sure if you've been following but I bought a pair of Apple AirPods Max from Amazon.com. They were sold by Amazon and shipped by Amazon. So they were not sold for me third party. Anyway, I found out they were counterfeit because they were not charging anymore. So I took them to Apple to have them repaired and that's who told me that they were counterfeit. So the weird thing is though is Apple let me put Apple Care on them. So I actually had Apple Care on counterfeit Apple AirPods Max.",subjective
@scheckeats_video_7242082388774473006.txt, I shoot to cook my breasts to 155 degrees internal in order to This video raises a really interesting point which I actually wrote about in the food safety section of my cookbook Don't poison yourself 165 Fahrenheit is heralded is the safe temperature for chicken because that's when all the salmonella is cooked off But it can be kind of dry if you cook it to that temperature What a lot of people don't know is that you can safely cook it to lower temperatures as long as You hold the temperature for the right amount of time So you can see at 165 to 162 It's less than 10 seconds is safe But you could cook it at 150 as long as you can hold it for 2.7 minutes Salmonella is not something to mess around with but if you're using a thermometer You could reasonably hold 155 for 45 seconds and the texture of the chicken will be a lot juicier,subjective
@feelgreataustralians_video_7253831977797782786.txt," 1.5-1,5-1,5-1,5-1,5-1,5-1,5-1,5-1,5-1,5-1,5-1,5-1,5-1,5-1,5-1,5-1,5-1,5-1,5-1,5-1,5-1,5-1,5-1,5-1,5-1,5-1,5-1,5-1,5-1,5-1,5-1,5-1,5-1,5-1,5-1,5-1,5-1,5-1,5-1,5-1,5-1,5-1,5-1,5-1,5-1,5-1,5-1,5-1,5-1,5-1,5-1,5-1,5-1,5-1,5-1,5 1,5-1,5-1,5-1,5-1,5-1,5-1,5-1,5-1,5-1,5-1,5-1,5-1,5-1,5-1,5-1,5-1,5-1,5-1,5-1,5-1,5-1,5-1,5-1,5-1,5-1,5-1,5-1,5-1,5-1,5-1,5-1,5-1,5-1,5-1,5-1,5-1,5-1,5-1,5-1,5-1,5-1,5-1,5-1,5-1,5-1,5-1,5-1,5-1,5-1,5-1,5-1,5-1,5-1,5-1,5-1 5-6-6-6-6-6-6-6-6-6-6-6-6-6-6-6-6-6-6-6-6-6-6-6-6-6-6-6-6-6-6-6-6-6-6-6-6-6-6-6-6-6-6-6-6-6-6-6-6-6-6-6-6-6-6-6-6-6-6-6-6-6-6-6-6-6-6-6-6-6-6-6-6-6-6-6-6-6-6-6-6-6-6-6-6-6-6-6-6-6-6-6-6-6-6-6-6-6-6-6-6-6-6-6-6-6-6-6-6-6-66-6-6-5-6-6-6-6-6-6-6-6-6-6-6-6-6-6-6-6-6-6-8-6-6-6-6-6-6-6-9-6-6-9-6-6-6-6-6, on L guerre there are mountains and oceans that battered to the West, and BC now martyr method than the roof crooked inches, and one sizes in one-чески Tuesday and other would have accident",subjective
@dreambabynames_video_7232289303349562666.txt," The Social Security Administration's top-into-2020 to our out and I've been waiting for this. Let's get into it. We see a lot of familiar ones. We have Liam Noah and Oliver at the top three, not surprised. Henry went up, as did a few others. Do we notice Jackson is fully off the list? Also very interesting to me, Asher made it to the top 20. For girls, our top four has stayed the same from 2021. Chloe made it to the list this year, and we have Sophia with an F going up. Sophia with an F and of the pH were both in the top 20, the year prior also, but the F is definitely gaining a little more traction. Violet as well, Violet made it to the top 20. I know everyone has been saying Violet surging, and I've been getting a ton of comments like everyone please stop using Violet. It's overkill. And it made it to the top 20.",subjective
@jenlovesfood_video_7293175413453491499.txt," Hello, my name is Jen and these are five foods that I would not eat as a food scientist and I am qualified to talk about this because I work in the food and dietary supplement industry as a quality safety and product development consultant Starting off strong at number one raw oysters. I am so sorry to the girly pop that 848 oysters on her first date. I know how much you love them, but I have good reason if contaminated raw oysters can carry a pathogen Belonning to the vibrio genus and cause an illness called vibrioosis Vibrioosis can cause symptoms like abdominal cramping Watery diarrhea vomiting fever chills. That's what I think now I personally preferred grilled oysters anyway. They have better flavor and I don't like the texture and it's just not worth the risk to me Number two is candied apples. I don't know if you say something so I'm not trying to be a hater. I love a good fall themed treat, but let me explain why There is a pathogen called Listeria monosatology is that is naturally occurring in the soil and there's many points of Contamination during the harvesting process of apples where the apples can be contaminated with this Now the reason why Listeria can be a problem with candied apples specifically is that there's obviously a spear here It's a spear that punctures and pushes that bacteria on the outside of the apple inside the juicy sugary center now pushed into the sugary center the Listeria now has food and it grows and grows and grows replicates You eat it and it makes you sick When ingested by pregnant women it could cause a phenomenon called spontaneous abortion not good Yeah, so I avoid it plus it's overrated anyway number three keenwa I didn't really want to say anything here. I just think it tastes like dirt So I do not eat it Number four raw milk. This is the only food on this list that I'm telling you Nobody should be drinking this absolutely nobody. Please stop listening to these TikTok influencers They say that it contains beneficial bacteria Baby it just contains bacteria in general. It is literally unpasturized drinking raw milk There's a huge risk of having a pathogenic contamination like E. coli and salmonella which cows are natural carriers of by the way Here behind me is a study of the gut microbiome and how pathogenic Organisms and the colonization in your gut have a role in inflammatory diseases because they Outcompete the good bacteria in your gut. So it's literally defeating the purpose Okay, that one got heated moving on number five alpha sprowts sprouts are grown by being soaked in water Now this type of environment that they're grown in is super super conducive to bacterial growth specifically salmonella E. coli, Listeria just Not the good ones. There are so many other veggies that I enjoy that I simply just I don't fugly The purpose of this video again is just to be informative um, you know, just eat at your own discretion I know a lot of these foods people enjoy But I just wanted to be informative of all the potential risks Just also just don't drink raw milk. That's literally the only one",subjective
@dimedocs_video_7330809469678505262.txt," If your credit score is under 700 and those charge offs and collections are stopping your credit from going up, or the people that actually do watch this whole video, all you gotta do is use the new FCR-A law that was revised in May 2023 to get off any bad account. How that the Equifax data breaches over, y'all need to, we need to, leverage the law that requires companies to delete the sputed unverified information without doing an investigation and sending you the documents y'all requests. This is what I mean. If the debt collector or the charge off account do not have a wet signature, state in that you are legally responsible for this debt, it's gonna get deleted off your credit report. Like for real, stop trying to pay these collections just for your score to go up 20 points, not even that, like 10. And then they still report on your account your credit report for seven years. I've been there, I done that, I'll show you. I asked fuck around and pay Wells Fargo. They reported payment after charge off for seven years. I mean literally reported charge offs for a whole year on my Experien report. Leverage the new FCR-A law, try all in my book. I finally got the Experien Collection Charge off on my report. I'm about to do TransUnionic. How about my score only went up like three points because the collection is so old. If I knew what I knew a lot sooner, what a bin start using the laws to fix my credit.",subjective
@npr_video_7268726001343991086.txt," There's a new field of research that could allow same sex and trans couples to have babies that are biologically related to both parents. It's called in vitro game to genesis, or IVG. Basically, the technology would let scientists take any cell from a person's body and turn it into a sperm or an egg. So maybe you take the DNA from someone's skin and with the magic of science, boom, sperm or egg. It's a little more complicated than that, but that's the general idea. And IVG could help anyone struggling with fertility issues, like a woman who lost her eggs due to cancer treatment could have new eggs produced, or a man with a low sperm count could have other cells from his body turned into more sperm. But critics are worried that people could use his technology in a bad or weird way. Like could you take the DNA from a deceased spouse and have their baby? Or what if you stole DNA from a celebrity and used it to make a baby without their permission? Or what if you made a baby using only your own DNA? You know there's some rich Meglemaniacs out there. We won't name names. Who I can imagine might think that was cool. The hope is that technology like this will be extremely regulated. And many of the scientists working on IVG say they welcome government regulation. Because it seems like it's not an if we get IVG. It's when.",subjective
@sofiasjournalshop_video_7332858422683127083.txt, 20 cm 10cm 1. många hoeolog pin,subjective
